,name,image,type,origin_year,date_added,views,videos,photos,comments,about,origin,other_text
25,"""That shit looks like the Battle Pass""",https://i.kym-cdn.com/entries/icons/original/000/036/908/2021-04-01_(1).png,"['Catchphrase', 'Reaction']",2021,2021-04-01T14:13:11-04:00,609,0,0,0,"This meme originated on TikTok at some point in early 2021, and doesn't really mean anything. It can be used in pretty much any situation, for example:",,"Or: Person A: ""Okay, here is your burger, have a nice day!"" Person B: ""Not gonna lie, this shit kinda looks like the battle pass."" Person A: ""…have a nice day, sir."" Or: Person A: ""911, what is your emergency, and do you need fire, police or medical?"" Person B: ""There's someone breaking into my house, I need police."" Person B: ""Okay sir, what is your home address?"" Person A: ""69420 dank drive, in Moscow, Texas."" Person B: ""Okay, help is on the way, is the intruder armed?"" Person A: ""Yeah, he got a gun. In fact, that shit kinda looks like the battle pass."" Person B: ""…Okay, stay where you are, we have SWAT, Navy Seals, the USMC, the SAS, Spetsnaz, an ICBM, GIGN, and a squadron of A-10 Warthogs approaching your location.""           Top entries this week       Fluffy Ponies        Vinesauce        Emergence (Metamorphosis)        Creepy Chan (Allison Harvard)      Latest Editorial And News       Woman's Public Freakout In Tim Horton's Again Rallies Internet Behind Service Industry Workers        Rapper DMX In Vegetative State After Heart Attack        Top TV Memes: The Best Meme Formats From 'Stranger Things'        After Addison Rae Backlash, Fallon Invites TikTok Dance Creators Onto Show"
26,TubbyCoin,https://i.kym-cdn.com/entries/icons/original/000/036/907/Ex4ep2CXMAIigcD.jpg,['Parody'],2021,2021-04-01T13:25:21-04:00,1520,0,19,4,"TubbyCoin refers to an April Fools' Day joke and a donation campaign launched by WildBrain in April 2021. A Teletubbies-based cryptocurrency parody, the campaign had users sharing the #TubbyCoin hashtag to increase the amount of money donated by the company when it debuted during the holiday.","On March 31st, 2021, the official Twitter[1] account for Teletubbies teased an announcement to be revealed later that week. The tweet used #Bitcoin hashtag and received over 12,700 retweets and 53,000 likes in two days (shown below). Additionally, the Teletubbies social media accounts changed their profile pictures to an image of Po with laser eyes, a reference to the Laser Eyes Bitcoin social media trend.","Top entries this week       Fluffy Ponies        Vinesauce        Emergence (Metamorphosis)        Creepy Chan (Allison Harvard)       Origin On March 31st, 2021, the official Twitter[1] account for Teletubbies teased an announcement to be revealed later that week. The tweet used #Bitcoin hashtag and received over 12,700 retweets and 53,000 likes in two days (shown below). Additionally, the Teletubbies social media accounts changed their profile pictures to an image of Po with laser eyes, a reference to the Laser Eyes Bitcoin social media trend.    On April 1st, 2021, the account announced[2] the introduction of TubbyCoin, an alt-coin based on HugTech technology, as its April Fools' joke for 2021 (tweet shown below). The tweet received over 5,700 retweets and 19,000 likes in one day, with the Instagram[3] post gaining over 2,000 likes.     On the same day, WildBrain, the company producing a spin-off animated Tiddlytubbies web series, made a blog post about TubbyCoin.[4] In the post, the company revealed that it would be donating $5,000 Canadian dollars to the Kids Help Phone charity and an additional $1 for every post using the #TubbyCoin hashtag on social media.  To mine TubbyCoin, all users need to do is share Big Hugs! tokens on social media with anyone who needs a hug, accompanied by the hashtag #TubbyCoin. Then, sit back and let HugTech do the rest, as your TubbyCoin grows in value by collecting good vibes from being so nice. […] For every TubbyCoin shared or liked on social media, we’ll add one additional dollar to our donation, up to a total of $10,000 CAD.                     Spread Starting on March 31st, following the teaser tweet, users on Twitter started making jokes and comments about a potential Teletubbies cryptocurrency. For example, on that day, Twitter[5] user @Renkindle posted a tweet that gained over 1,600 retweets and 6,700 likes (shown below, left). On the same day, Twitter[6] user @LizardRumsfeld made a post that gained over 290 retweets and 5,700 likes (shown below, right).     On April 1st, 2021, following the announcement, TubbyCoin continued to remain a viral topic of discussion, with a number of users praising the donation campaign (examples shown below).     On April 1st, the joke was reported on by multiple news outlets including The Guardian[7] and Pop Culture.[8]                    Various Examples                             Search Interest     External References  [1] Twitter – @TeletubbiesHQ [2] Twitter – @TeletubbiesHQ [3] Instagram – teletubbieshq [4] WildBrain – New virtual currency from the colourful fab four harnesses innovative HugTech! [5] Twitter – @Renkindle [6] Twitter – @LizardRumsfeld [7] The Guardian – April fools innovations: from TubbyCoins to socially networked cows [8] Popculture – Teletubbies Cryptocurrency      Latest Editorial And News       Woman's Public Freakout In Tim Horton's Again Rallies Internet Behind Service Industry Workers        Rapper DMX In Vegetative State After Heart Attack        Top TV Memes: The Best Meme Formats From 'Stranger Things'        After Addison Rae Backlash, Fallon Invites TikTok Dance Creators Onto Show"
27,Gorilla Grip,https://i.kym-cdn.com/entries/icons/original/000/036/906/gorilla-1.jpg,['Slang'],2019,2021-04-01T12:43:04-04:00,902,0,3,0,"Gorilla Grip, also known as Gorilla Grip Coochie, is a slang expression used to describe the relative ""tightness"" or strength with which a woman can clench their vagina during intercourse. The phrase grew in popularity on social media during in 2020, becoming a trend on TikTok shortly after, where TikTokers on GripTok, a subculture of the social media site dedicated to Kegel exercises that strengthen the pelvic area, perform Kegels to the beat of various songs.","On March 28th, 2019, Twitter [1] user @scifibritt tweeted the earliest known usage of the phrase ""gorilla grip coochie."" In response to a tweet about skincare, they wrote, ""gorilla grip coochie, too"" (shown below).","Top entries this week       Fluffy Ponies        Vinesauce        Emergence (Metamorphosis)        Creepy Chan (Allison Harvard)       Origin On March 28th, 2019, Twitter [1] user @scifibritt tweeted the earliest known usage of the phrase ""gorilla grip coochie."" In response to a tweet about skincare, they wrote, ""gorilla grip coochie, too"" (shown below).    Spread Months later, on December 29th, 2019, Redditor Pr0Rapture shared a Facebook meme in the /r/BrandNewSentence[2] subreddit. It reads, ""Sex Tip: Put a little pepper on her pillow so when you put her face in it she sneezes & her coochie girl you like a gorilla fist."" The post received more than 29,000 points (94% upvoted) and 245 comments in less than two years (shown below, left). While there are several variations of the term on Urban Dictionary, [3] the definition that relates most to this usage of the phrase was posted by Busted cooter on July 4th, 2020. They wrote, ""When the monkey is so tight when you try to pull out you can feel it sucking your dick Back in like a plunger"" (shown below, right).     On August 13th, 2020, rapper Sinoda posted song ""Gorilla Grip"" on YouTube. In the song, he raps, ""No lip, with some change and gorilla grip / Pop that shit like aye, aye, aye, ok."" The post received more than 480,000 views in less than one year (shown below).  GripTok In 2020, Kegel exercises became a popular topic on TikTok, where users would share tips for performing pelvic exercises with the goal of reaching a ""gorilla grip"" vagina. Within one year, the hashtag #griptok[4] has more than 50 million views (example below, left). Other videos feature TikTokers performing Kegel exercises to the beat of a song (example below, right). Many of these videos feature the emojis copypasta ""💢⭕️💢,"" which is a visual signifier for Kegels.     Criticism On March 31st, 2021, Mashable [5] covered the trend and criticized the necessity for exercises such as these. They indicate that these exercises enforce cultural stereotypes about female sexuality that do not actually result in positive health. In the article, obstetrician-gynecologist Dr. Jennifer Lincoln said, ""Being 'tight' is really a placeholder for saying society values young virginal women, and having sex therefore makes you dirty and loose. All of this nonsense belongs in the garbage.""            Various Examples                  Search Interest     External References  [1] Twitter – @scifibritt's Tweet [2] Reddit – /r/brandnewsentence [3] Urban Dictionary – Gorilla Grip [4] TikTok – #griptok [5] Mashable – 'GripTok' and the myth of the 'gorilla grip' coochie      Latest Editorial And News       Woman's Public Freakout In Tim Horton's Again Rallies Internet Behind Service Industry Workers        Rapper DMX In Vegetative State After Heart Attack        Top TV Memes: The Best Meme Formats From 'Stranger Things'        After Addison Rae Backlash, Fallon Invites TikTok Dance Creators Onto Show"
28,Let Me In Please (Charli D'Amelio),https://i.kym-cdn.com/entries/icons/original/000/036/905/letmeincover.jpg,"['Participatory Media', 'Remix', 'Viral Video']",2020,2021-04-01T12:32:24-04:00,6312,25,0,0,Let Me In Please (Charli D'Amelio) refers to a viral video taken from a Ring doorbell camera in which TikToker Charli D'Amelio excessively knocks on a door and pleads for someone to let her in. The video inspired a viral sound on TikTok in late 2020 throughout early 2021 and has appeared in a number of video edits and remixes.,"On November 22nd, 2020, TikToker and YouTuber[1] Thomas Petrou, a member of the influencer-run Hype House, posted a vlog featuring Charli D'Amelio. At the 6:55 timestamp, Petrou congratulates D'Amelio for reaching 100 million followers, then shows what he introduces as a ""very funny clip from the Ring doorbell a couple weeks ago"" in honor of her. In the clip, D'Amelio skips toward the doorbell then starts knocking impatiently, pleading for Petrou to let her in and saying ""it's been two minutes,"" implying she's been waiting too long (shown below). The vlog gained over 1.3 million views in five months.","Top entries this week       Fluffy Ponies        Vinesauce        Emergence (Metamorphosis)        Creepy Chan (Allison Harvard)       Origin On November 22nd, 2020, TikToker and YouTuber[1] Thomas Petrou, a member of the influencer-run Hype House, posted a vlog featuring Charli D'Amelio. At the 6:55 timestamp, Petrou congratulates D'Amelio for reaching 100 million followers, then shows what he introduces as a ""very funny clip from the Ring doorbell a couple weeks ago"" in honor of her. In the clip, D'Amelio skips toward the doorbell then starts knocking impatiently, pleading for Petrou to let her in and saying ""it's been two minutes,"" implying she's been waiting too long (shown below). The vlog gained over 1.3 million views in five months.  On November 25th, YouTubers[2][3] I love Tik Tok and Chloe Haliligamer posted the isolated clip of D'Amelio at the door, garnering over 663,000 views on the former and 382,000 on the latter in five months, helping to spread the clip.                    Spread On December 4th, YouTuber[4] Funny Cat posted a video editing together footage from a scene in Stanley Kubrik's The Shining when Jack is busting down the door with an axe, mixing in audio of Charli and putting her face in the broken doorway, garnering over 349,000 views in four months (shown below).  On December 12th, German TikToker[5] @kruemelkeks_20 posted an edited version of the video, garnering over 6 million views in four months (shown below).  The original sound for the video, consisting of D'Amelio knocking and saying, ""let me in, let me in, please,"" inspired a number of viral videos on the platform starting in January 2021. For example, on January 18th, TikToker[7] @kendorklamar posted a lip-dub skit reenacting the video, garnering over 2.6 million views in two months (shown below, left). On January 19th, TikToker[8] @noah.mackrill then posted a similar lip-dub skit, garnering over 6.6 million views in a comparable span of time (shown below, right).    In February, Minecraft YouTuber GeorgeNotFound changed his Twitch donation sound to an audio clip of D'Amelio saying ""let me in please,"" which has startled him a number of times. On February 11th, YouTuber[9] Leigh uploaded a compilation of this happening, garnering over 1.9 million views in two months (shown below).  On March 16th, 2021, YouTuber[6][10] memes by cowbelly posted an original edit featuring the clip, garnering over 359,000 views in two weeks (shown below, left). On March 22nd, they posted another edit of the clip, garnering over 108,000 views in just over a week (shown below, right).                        Various Examples                       Search Interest     External References  [1] YouTube – Larray Flirted With Me In Front Of Mia… [2] YouTube – Charli D’amelio knocking on dixie D’amelio door saying 'let me in' [3] YouTube – “lEt Me iN pLeAsE!“ – Charli D’amelio – original video | Cloudy Mashups [4] YouTube – Charli D'amelio let me in please [5] TikTok – Tja ich war das nicht [6] YouTube – LET ME IN [7] TikTok – my girls know this one [8] TikTok – #fyp #fypシ #nolook #britishbasketball #dogDJ [9] YouTube – George getting scared by Charli D'Amelio's 'let me in please' [10] YouTube – Charli is stuck 20,000 feet in the air      Latest Editorial And News       Woman's Public Freakout In Tim Horton's Again Rallies Internet Behind Service Industry Workers        Rapper DMX In Vegetative State After Heart Attack        Top TV Memes: The Best Meme Formats From 'Stranger Things'        After Addison Rae Backlash, Fallon Invites TikTok Dance Creators Onto Show"
29,Naming Your Child After a Fictional Character,https://i.kym-cdn.com/entries/icons/original/000/036/904/cover1.jpg,"['Exploitable', 'Image Macro']",2021,2021-04-01T11:24:33-04:00,2452,0,24,2,Naming Your Child After a Fictional Character refers to a Wojak Comics format in which two parent-child conversations about the child's name are compared against each other. The format gained popularity on Facebook and Reddit in late March 2021 as an exploitable format.,"On March 26th, 2021, the Facebook[1] page Strengthwave posted a Wojak comic in which a child named after a Game of Thrones character, Khaleesi, complained about her name to her parent, while a child named after the Christian saint Albertus Magnus expressed his love for his parent. The post (shown below) received over 2,500 reactions and 1,900 shares in one week.","Top entries this week       Fluffy Ponies        Vinesauce        Emergence (Metamorphosis)        Creepy Chan (Allison Harvard)       Origin On March 26th, 2021, the Facebook[1] page Strengthwave posted a Wojak comic in which a child named after a Game of Thrones character, Khaleesi, complained about her name to her parent, while a child named after the Christian saint Albertus Magnus expressed his love for his parent. The post (shown below) received over 2,500 reactions and 1,900 shares in one week.                       Spread On March 26th, the meme was shared by Facebook[2] page Katoliko Memes PH 2, gaining over 1,000 reactions, and Twitter[3] user @ThcottyNodak, gaining over 240 retweets and 2,000 likes in one week. On March 27th, Redditor[4] JorisJobana then reposted the meme to /r/HistoryMemes where it gained over 22,200 upvotes in one week. On the same day, the Facebook[5] page Orthodox Meme Squad posted the first derivative of the meme based on the image, altering the name of the mentioned saint (shown below, left). The post received over 780 reactions and 50 shares in one week. On March 27th, the Facebook[6] page CathJuche: the party is back posted another meme based on the format, which received over 500 reactions and nearly 100 shares (shown below, right).     On March 28th, following the March 27th repost[4] of the original meme, the format gained popularity on Reddit. On that day, Redditor[7] thegamingkaiser posted a Political Compass meme that gained over 17,600 upvotes in five days (shown below, left). On the same day, Redditor[8] RollsReusReign then posted a meme that gained over 17,500 upvotes in the same period (shown below, right).     In the following days, the format maintained moderate popularity on Facebook and Reddit.                    Various Examples          Template                       Search Interest     External References  [1] Facebook – Strengthwave [2] Facebook – Katoliko Memes PH 2 [3] Twitter – @ThcottyNodak [4] Reddit – Biggus Dickus [5] Facebook – Orthodox Meme Squad [6] Facebook – CathJuche: the party is back [7] Reddit – The next generation of kids will get bullied so hard. [8] Reddit – Even biggus dickus       Latest Editorial And News       Woman's Public Freakout In Tim Horton's Again Rallies Internet Behind Service Industry Workers        Rapper DMX In Vegetative State After Heart Attack        Top TV Memes: The Best Meme Formats From 'Stranger Things'        After Addison Rae Backlash, Fallon Invites TikTok Dance Creators Onto Show"
30,Arrogant John Walker,https://i.kym-cdn.com/entries/icons/original/000/036/903/john1.jpg,"['Pop Culture Reference', 'Reaction', 'Image Macro']",2021,2021-04-01T10:02:33-04:00,1064,0,14,6,"Arrogant John Walker refers to an image of John Walker (played by Wyatt Russell) wearing Captain America's suit and smiling arrogantly, taken from episode two of the Marvel mini-series The Falcon and the Winter Soldier. Shortly after airing in March 2021, Twitter and Tumblr users began making jokes portraying the character as a ""typical arrogant white guy.""","On March 26th, 2021, the second episode of the Disney+ mini-series The Falcon and the Winter Soldier premiered on the platform. In the episode, John Walker takes over for the now deceased Captain America. As he first appears in the suit, he strikes an arrogant smile and posture, as if completely prepared to take on the role of Captain America. Further, the character is portrayed as fairly arrogant throughout the series.","Top entries this week       Fluffy Ponies        Vinesauce        Emergence (Metamorphosis)        Creepy Chan (Allison Harvard)       Origin On March 26th, 2021, the second episode of the Disney+ mini-series The Falcon and the Winter Soldier premiered on the platform. In the episode, John Walker takes over for the now deceased Captain America. As he first appears in the suit, he strikes an arrogant smile and posture, as if completely prepared to take on the role of Captain America. Further, the character is portrayed as fairly arrogant throughout the series. The day the episode was released, Twitter users began criticizing the character. For example, on that day, Twitter[1] user @agonicks posted a screenshot from the Harry Potter series of the titular character saying, ""How dare you stand where he stood?"" criticizing Walker as a replacement for Captain America, garnering over 1,300 likes and 200 retweets in six days (shown below, left). On the same day, Polygon[4] posted an article describing how Walker becomes a villain in the comics including an image of Walker from the series looking arrogant (shown below, right).     On March 28th, Tumblr[5] user ken0bes posted an image of a fish punching the ground from SpongeBob Squarepants photoshopped to say, ""I never wanted to punch someone so bad in my entire life, never I swear,"" followed by the same image of Walker used in the Polygon article, garnering over 530 notes in four days (shown below). This is the earliest known use of the image as a meme.                       Spread On March 29th, 2021 Twitter[3] user @UpToTASK posted the image, writing, ""This guy is the @MichaelRapaport of the MCU"" (shown below), garnering over 260 likes in three days and inspiring a string of tweets[6][7] in which users upload the image and attribute various arrogant text to it (examples shown below, left and right).     On the same date, Tumblr[2] user cryoverkiltmilk then posted the same image of Walker under text imagining how the casting call for the role might have gone, garnering over 250 notes in four days (shown below).                       Various Examples                            Search Interest     External References  [1] Twitter – me at john walker [2] Tumblr – has never experienced a consequence in their life#= [3] Twitter – UpToTASK [4] Polygon – Falcon and the Winter Soldier’s new Captain America is trouble in the comics [5] Tumblr – i just wanna punch him#= [6] Twitter – It's about ethics in journalism [7] Twitter – women just don't like star wars      Latest Editorial And News       Woman's Public Freakout In Tim Horton's Again Rallies Internet Behind Service Industry Workers        Rapper DMX In Vegetative State After Heart Attack        Top TV Memes: The Best Meme Formats From 'Stranger Things'        After Addison Rae Backlash, Fallon Invites TikTok Dance Creators Onto Show"
31,She Sells Seashells on the Sea Shore,https://i.kym-cdn.com/entries/icons/original/000/036/902/Ren_-_Money_Game_part_2_1-43_screenshot.png,"['Song', 'Pop Culture Reference']",2021,2021-04-01T09:46:38-04:00,2462,60,0,1,"She Sells Seashells by the Sea Shore refers to a series of memes based on the second verse of the song ""Money Game Part 2"" by rapper Ren, which starts with a lyric from the 19th-century tongue twister ""she sells seashells by the seashore."" The format gained popularity following a meme uniting a cutscene from Super Mario Galaxy with the song.","On April 16th, 2020, rapper Ren posted a music video for his song ""Money Game Part 2"" to YouTube (shown below).[1]","Top entries this week       Fluffy Ponies        Vinesauce        Emergence (Metamorphosis)        Creepy Chan (Allison Harvard)       Origin On April 16th, 2020, rapper Ren posted a music video for his song ""Money Game Part 2"" to YouTube (shown below).[1]   She sells seashells on the seashore But the value of these shells will fall Doe to the laws of supply and demand No one wants to buy shells cus there's loads on the sand  The song borrowed its second verse lyric ""she sells seashells on the seashore"" from a tongue-twister originally published in 1850.[2] In August 2020, the video received viral spread on iFunny. On August 23rd, iFunny[3][4] user SuperSaiyanEmu reposted the second verse of the song, with the clip gaining over 64,700 smiles on the app in seven months. On August 29th, iFunny[5] user BlorpMan made another repost, gaining over 50,400 smiles in the same period. The meme did not see further spread until on February 27th, 2021, YouTube[6] user Axema Vales combined the verse with a clip of Luigi talking to Luigi in the Dusty Dune Galaxy level of Super Mario Galaxy (meme shown below, left, origin clip shown below, right).     The Super Mario Galaxy clip saw prior use in memes in 2020.[7]                    Spread In the following week, the video received viral spread online through multiple reposts. On March 4th, 2021, Ren posted the video on his Instagram[8] account. Also on March 4th, Redditor jeremiahn4 posted the lyrics of the verse to the /r/copypasta[9] subreddit. In the following weeks, the video inspired multiple edits based on the verse, particularly on YouTube. For example, on March 5th, 2021, YouTube[10] user Sharkestry ! posted a Wojak edit that gained over 31,200 views in one month (shown below, left). On March 8th, Redditor[11] Danny-DevitoTrashMan then posted a Doge edit that received over 20,200 upvotes in the /r/dogelore subreddit (reupload shown below, right).     On April 1st, 2021, YouTube[12] channel Lessons in Meme Culture posted a video about the meme explaining what it was.                    Various Examples                          Search Interest     External References  [1] YouTube – Ren – Money Game part 2 [2] Wikipedia – Tognue-twister. [3] TikTok – @mellments [4] iFunny – SuperSaiyanEmu [5] iFunny – BlorpMan [6] YouTube – luigi talks about sea shells [7] Reddit – The Big Bang theory but awesome [8] Instagram – renmakesmusic [9] Reddit – She sells sea shells on the sea shore [10] YouTube – Ren – Money Game part 2 but I edited in wojaks [11] Reddit – She sells sea shells rap [12] YouTube – Why Is Luigi Selling Sea Shells?      Latest Editorial And News       Woman's Public Freakout In Tim Horton's Again Rallies Internet Behind Service Industry Workers        Rapper DMX In Vegetative State After Heart Attack        Top TV Memes: The Best Meme Formats From 'Stranger Things'        After Addison Rae Backlash, Fallon Invites TikTok Dance Creators Onto Show"
