,name,image,type,origin_year,date_added,views,videos,photos,comments,about,origin,other_text
15,#IArmTheFool,https://i.kym-cdn.com/entries/icons/original/000/036/918/Screen_Shot_2021-04-02_at_11.01.41_AM.png,['Hashtag'],2021,2021-04-02T11:17:00-04:00,8225,0,8,9,"#iarmthefool refers to an April Fools' Day 2021 event among webcomic artists in which the artists posted a comic featuring a gag centered around large, unnaturally long arms. The name is a play on ""I am the fool,"" which was a 2016 April Fools' event in which dozens of webcomic artists posted a comic with the same basic premise ending with the punchline ""Maybe I am the fool.""","On April 1st, 2021, dozens of webcomic artists began posting comics that centered on the same gag of a character in the comic having unnaturally long arms, sharing the posts with the hashtag #IArmTheFool. The name is a play on a 2016 April Fools prank organized by Alex Norris in which webcomic artists all posted a very similar comic with the punchline ""Maybe I am the fool.""[1] In 2019, webcomic artists pulled a similar prank in which they drew their characters with hyperrealistic eyes with the hashtag #EyeAmTheFool.","Top entries this week       Fluffy Ponies        Vinesauce        Emergence (Metamorphosis)        Creepy Chan (Allison Harvard)       Origin On April 1st, 2021, dozens of webcomic artists began posting comics that centered on the same gag of a character in the comic having unnaturally long arms, sharing the posts with the hashtag #IArmTheFool. The name is a play on a 2016 April Fools prank organized by Alex Norris in which webcomic artists all posted a very similar comic with the punchline ""Maybe I am the fool.""[1] In 2019, webcomic artists pulled a similar prank in which they drew their characters with hyperrealistic eyes with the hashtag #EyeAmTheFool. While it's unclear who organized the 2021 #IArmTheFool trend, the earliest post featuring the hashtag posted to Instagram was by user mushroommovie, gaining over 8,700 views (shown below).               View this post on Instagram                      A post shared by mushroom movie (@mushroommovie)                       Spread Throughout the day, webcomic artists posted variations on #IArmTheFool. There are 155 posts with the hashtag on Instagram[2] and many more on Twitter. Popular examples include a comic by the_reddot[3] that gained over 30,000 likes on Instagram (shown below, left) and a comic by @lastplacecomics[4] that gained over 600 retweets and 4,000 likes on Twitter (shown below, right).                        Various Examples                            Search Interest     External References  [1] The Verge – Why did webcomic artists all post the same comic today, making fools out of us? [2] Instagram – #iarmthefool search [3] Instagram – the_reddot [4] Twitter – lastplacecomics      Latest Editorial And News       Woman's Public Freakout In Tim Horton's Again Rallies Internet Behind Service Industry Workers        Rapper DMX In Vegetative State After Heart Attack        Top TV Memes: The Best Meme Formats From 'Stranger Things'        After Addison Rae Backlash, Fallon Invites TikTok Dance Creators Onto Show"
16,I Could've Dropped My Croissant,https://i.kym-cdn.com/entries/icons/original/000/036/917/croissantcover.jpg,"['Participatory Media', 'Viral Video']",2014,2021-04-02T10:27:38-04:00,1939,41,2,9,"I Could've Dropped My Croissant refers to a viral 2014 Vine clip in which the person filming scares his friend, who is holding a croissant on a plate, resulting in him yelling, ""Stop, I could've dropped my croissant!"" The video went viral shortly after appearing on Vine, inspiring numerous reactions, tributes and two viral sounds on TikTok over the course of seven years.","On February 6th, 2014, Vine[1] user @terryjr12, aka Terry, uploaded a video in which he scares his friend Terrel as he's turning the corner with a croissant. Terrel screams then exclaims, ""Stop, I could've dropped my croissant!"" as Terry laughs. The video gained over 6.7 million loops, 141,000 re-Vines and 149,000 likes before Vine was shut down in 2016. The video was then reuploaded to YouTube[2] on February 10th, garnering over 4.6 million views in a comparable span of time (shown below).","Top entries this week       Fluffy Ponies        Vinesauce        Emergence (Metamorphosis)        Creepy Chan (Allison Harvard)       Origin On February 6th, 2014, Vine[1] user @terryjr12, aka Terry, uploaded a video in which he scares his friend Terrel as he's turning the corner with a croissant. Terrel screams then exclaims, ""Stop, I could've dropped my croissant!"" as Terry laughs. The video gained over 6.7 million loops, 141,000 re-Vines and 149,000 likes before Vine was shut down in 2016. The video was then reuploaded to YouTube[2] on February 10th, garnering over 4.6 million views in a comparable span of time (shown below).  The video was reposted and shared across social media platforms numerous times over the following year, gaining significant attention by 2015. On March 14th, 2015, Instagram[3] page @h0odvine_ posted the video, garnering over 19,400 likes in six years. On April 15th, Facebook[4] page LOL Network shared the video, garnering over 249,000 reactions, 171,000 shares in a comparable span of time.                    Spread The ""croissant Vine"" has been included in countless Vine compilations and is often considered one of the platform's best videos. On February 16th, 2016, Ellen DeGeneres reacted to the video on her television show (seen below).  On July 7th, 2017, YouTubers[5] BROTHER, a page run by Terry and Terrel, posted a storytime video sharing the tale of the croissant Vine (shown below). In the video, Terrel notes that people have yelled ""croissant boy"" to him before at college because of the video.  On January 3rd, 2018, Twitter[8] user @zephanijong began a thread where they posted drawings of single frames from famous Vine videos. On January 4th, they added a drawing of a frame from the croissant Vine to the thread,[9] garnering over 41,700 likes and 9,500 retweets in three years (shown below). The thread itself gained over 183,000 likes and 106,000 retweets in a comparable span of time.    TikTok Sounds Sometime in February 2020, an original sound consisting of a number of original Vine audio clips went viral on TikTok, mostly used in a game where users try to lip-sync to the sounds they know as they come up (examples shown below, left and right). The croissant Vine is the first clip in the sound, which has been used in over 50,000 videos in a year.    On April 10th, 2020, TikToker[6] ciscokidd23 uploaded the original croissant Vine to the platform, garnering over 10 million views in a year. The original sound[7] for the video inspired over 55,000 videos over the course of the year, many reenactments and tributes to the original in which someone skillfully saves a croissant from falling to the ground (examples shown below, left and right).                       Various Examples                       Search Interest     External References  [1] Vine – I could've dropped my croissant [2] YouTube – Almost Dropped His Croissant.LDTbest Vines [3] Instagram – Coulda dropped my croissant !!! 😂💀#hoodvine #hoodvines @hoodvinebackup [4] Facebook – I could have dropped my croissant! LOL [5] YouTube – STORY TIME : OUR FAMOUS CROISSANT VINE [6] TikTok – funny #funnyhashtag #fyp [7] TikTok – original sound [8] Twitter – i'm rlly bored so here's a vine thread but as bad sticky note doodles [9] Twitter – I COULD'VE DROPPED MY CROISSANT      Latest Editorial And News       Woman's Public Freakout In Tim Horton's Again Rallies Internet Behind Service Industry Workers        Rapper DMX In Vegetative State After Heart Attack        Top TV Memes: The Best Meme Formats From 'Stranger Things'        After Addison Rae Backlash, Fallon Invites TikTok Dance Creators Onto Show"
17,That's Kind Of Hot,https://i.kym-cdn.com/entries/icons/original/000/036/916/Screen_Shot_2021-04-05_at_2.17.19_PM.png,"['Catchphrase', 'Participatory Media']",2013,2021-04-02T10:25:44-04:00,3123,0,25,1,"That's Kind Of Hot is a quote from a webcomic posted in 2014 by online furry artist Matthew Rathew. The anthropomorphic fox who says the phrase has been the subject of numerous redraws, and the corresponding panel was used by many Internet users as a smut-related reaction image.","On April 24th, 2013, Fur Affinity[1] user Matt_Rat posted a comic featuring two anthropomorphic characters, one based on a male wolf and the other on a female fox. The latter reacts to the former peeping at her bottom by pointing out that ""poop comes from there"", to which he replies: ""That's kind of hot"", shocking her in return.","Top entries this week       Fluffy Ponies        Vinesauce        Emergence (Metamorphosis)        Creepy Chan (Allison Harvard)       Origin On April 24th, 2013, Fur Affinity[1] user Matt_Rat posted a comic featuring two anthropomorphic characters, one based on a male wolf and the other on a female fox. The latter reacts to the former peeping at her bottom by pointing out that ""poop comes from there"", to which he replies: ""That's kind of hot"", shocking her in return.                       Spread This comic quickly gained popularity and drew attention outside of the furry fandom, with both the wolf's statement and the fox's reaction seeing use as reaction images, as an often ironic approval of a fetish in the case of the former, and for expressing shock or disgust in the case of the latter. The comic was also a source of inspiration for many redraws, especially the mentioned panels (examples shown below).     One of Matt Rat's most popular tweets[2] dates from May 23rd, 2017, and celebrates the 4th anniversary of his comic.                    Various Examples         Search Interest Unavailable                    External References  [1] Fur Affinity (NSFW) – I'm not quoting that meme for this [2] Twitter – Matt Rat      Latest Editorial And News       Woman's Public Freakout In Tim Horton's Again Rallies Internet Behind Service Industry Workers        Rapper DMX In Vegetative State After Heart Attack        Top TV Memes: The Best Meme Formats From 'Stranger Things'        After Addison Rae Backlash, Fallon Invites TikTok Dance Creators Onto Show"
18,"Waking Up in the Morning, Thinking About So Many Things",https://i.kym-cdn.com/entries/icons/original/000/036/915/cover1.jpg,"['Participatory Media', 'Song']",2021,2021-04-02T10:17:22-04:00,1821,53,0,0,"Waking Up in the Morning, Thinking About So Many Things refers to a 2011 song by Gia Giudice, daughter of The Real Housewives of New Jersey star Teresa Giudice, written about a conflict between the Giudice and Gorga families on the show. In March 2021, the song gained viral popularity on TikTok with users sharing awkward or cringy stories from their life while the song is playing.","On September 11th, 2011, episode 16, titled ""Singing in the Pain,"" of The Real Housewives of New Jersey reality television series premiered.[1] In the episode, Gia Giudice, the daughter of cast member Teresa Giudice, performs her own song while fighting back tears. In the episode, Giudice reveals that the song is ""especially for my mom and [her brother] Joe Gorga,"" who, at that time, were embroiled in conflict.[2][3]","Top entries this week       Fluffy Ponies        Vinesauce        Emergence (Metamorphosis)        Creepy Chan (Allison Harvard)       Origin On September 11th, 2011, episode 16, titled ""Singing in the Pain,"" of The Real Housewives of New Jersey reality television series premiered.[1] In the episode, Gia Giudice, the daughter of cast member Teresa Giudice, performs her own song while fighting back tears. In the episode, Giudice reveals that the song is ""especially for my mom and [her brother] Joe Gorga,"" who, at that time, were embroiled in conflict.[2][3]   Waking up in the morning Thinking about so many things I just wish things would get better I’m trying to get rid of them But nothing seems to stay the same Woke up in the morning Doing my hair and makeup Getting my clothes on Walking into school Thinking about what’s going to happen next  On January 10th, 2021, TikTok[4] user amiryassofficial used the video in a meme about the upcoming inauguration of Joe Biden, captioning the clip ""Trump on January 20th."" The post received over 10.3 million views and 962,000 likes in three months (shown below).                  Spread The song did not see viral use on the app until early March 2021. On March 3rd, 2021, TikTok[5] user taaaaayylorrrrrleaaaaaaa used the song in a Dad and the Dog video that received over 13.2 million views and 3.1 million likes in one month (shown below, left). Later on the same day, TikTok[6] user @brodarragh posted a video in which he shared a memory of filming his friend getting his first hug from a girl. The video received over 15.7 million views and 3.9 million likes in one month (shown below, right).     In the following month, the meme format where TikTokers share awkward or cringy memories while the song is playing gained viral popularity. For example, on March 3rd, 2021, TikTok[7] user @michaelslagel posted a video that received over 20.1 million views and 5.1 million likes in one month (shown below, left). On March 17th, actor Will Smith posted a TikTok[8] that received over 24.2 million views and 6.3 million likes in two weeks (shown below, center). On March 27th, Gia Giudice posted a TikTok[9] in which she lip-synced her own song, with the video gaining over 3.8 million views and 317,200 likes in one week (shown below, right).      In late March 2021, several news outlets reported on the meme, including articles by Cosmopolitan[2] and E! Online.[3]                 Various Examples                         Search Interest     External References  [1] Wikipedia – The Real Housewives of New Jersey [2] Cosmopolitan – The Iconic Origins of TikTok’s Viral 'Waking Up in the Morning' Song [3] E! Online – The Bizarre Story Behind the ""Waking Up in the Morning"" Song Taking Over TikTok [4] TikTok – @amiryassofficial  [5] TikTok – @taaaaayylorrrrrleaaaaaaa [6] TikTok – @brodarragh [7] TikTok – @michaelslagel [8] TikTok – @6940834479539834117 [9] TikTok – @giagiudicexx      Latest Editorial And News       Woman's Public Freakout In Tim Horton's Again Rallies Internet Behind Service Industry Workers        Rapper DMX In Vegetative State After Heart Attack        Top TV Memes: The Best Meme Formats From 'Stranger Things'        After Addison Rae Backlash, Fallon Invites TikTok Dance Creators Onto Show"
19,Since Day One,https://i.kym-cdn.com/entries/icons/original/000/036/914/Dax_Skate.jpg,['Photoshop'],2013,2021-04-02T03:32:37-04:00,214,0,0,0,"When the wife of Redditor centsless43 asked him to take a photo of their six-month old baby this is not what she expected. Fear not, this is not another Tony Hawk controversy but rather a clever use of photoshop to remove himself from the picture (reminiscent of the previously featured: Henry the Flying Baby).",,"Top entries this week       Fluffy Ponies        Vinesauce        Emergence (Metamorphosis)        Creepy Chan (Allison Harvard)      Latest Editorial And News       Woman's Public Freakout In Tim Horton's Again Rallies Internet Behind Service Industry Workers        Rapper DMX In Vegetative State After Heart Attack        Top TV Memes: The Best Meme Formats From 'Stranger Things'        After Addison Rae Backlash, Fallon Invites TikTok Dance Creators Onto Show"
20,papi jiang,https://i.kym-cdn.com/entries/icons/original/000/036/913/Imagen_1.png,['Character'],2012,2021-04-02T02:01:28-04:00,189,0,0,0,"Papi 酱, whose real name is Jiang Yilei, was born in Shanghai on February 17, 1987. She is a mainland Chinese actress and short video creator. She graduated from the director department of the Central Academy of drama.
In 2007, in charge of Shanghai TV sports channel “health fashion” column of the early editing and dubbing work. In 2009, starred in the drama “the only child – let you wayward.”. In 2015, we began to upload original short videos on the Internet. In 2016, Papi酱won a certain degree of attention on the Internet by virtue of the original video content released in the form of voice change; in the same year, it won the top ten video celebrities award of super red man festival microblog. In 2017, his first film, demon bell, was released. In 2018, he officially served as the chief content officer of Baidu app. In 2019, he participated in the recording of Tencent's reality TV program ""exciting offer"" for legal career observation",,"Top entries this week       Fluffy Ponies        Vinesauce        Emergence (Metamorphosis)        Creepy Chan (Allison Harvard)      Latest Editorial And News       Woman's Public Freakout In Tim Horton's Again Rallies Internet Behind Service Industry Workers        Rapper DMX In Vegetative State After Heart Attack        Top TV Memes: The Best Meme Formats From 'Stranger Things'        After Addison Rae Backlash, Fallon Invites TikTok Dance Creators Onto Show"
21,Little Dark Age,https://i.kym-cdn.com/entries/icons/original/000/036/912/bbe81f92c232040574c4070f15d361a2.png,['Song'],2017,2021-04-01T18:54:10-04:00,7818,45,0,9,Little Dark Age is a song by American band MGMT that later surged in popularity in late 2020 after being sampled in a series of TikTok videos.,"""Little Dark Age"" was released by MGMT on October 17th, 2017 as the title song of their fourth album, Little Dark Age. The accompanying music video, uploaded[1] to YouTube on the same day, has garnered over 35 million views (shown below). Other videos on YouTube with audio only[2][3] have accumulated more than 30 million views while the song has upwards of 120 million plays[4] on Spotify.","Top entries this week       Fluffy Ponies        Vinesauce        Emergence (Metamorphosis)        Creepy Chan (Allison Harvard)       Origin ""Little Dark Age"" was released by MGMT on October 17th, 2017 as the title song of their fourth album, Little Dark Age. The accompanying music video, uploaded[1] to YouTube on the same day, has garnered over 35 million views (shown below). Other videos on YouTube with audio only[2][3] have accumulated more than 30 million views while the song has upwards of 120 million plays[4] on Spotify.                     Spread On September 2nd, 2020, TikTok user anti.audios uploaded[5] a TikTok featuring a slowed version of Little Dark Age (shown below). It was inspired by an earlier video[6] posted in July by hudsoncosplay. The sound from anti.audios' TikTok has been used in over 200,000 videos as of April 1st, 2020.[7] According to Google Trends, the song suddenly gained interest in the week of October 4th, 2020 before peaking in the week of November 15th.  Time Warp Scans Some of the TikToks featuring ""Little Dark Age"" include the Time Warp Scan filter,[8] utilizing the filter to create dark images, such as Baphomet (compilation shown below, left). Other videos utilize the song in recreations[9] of old paintings (compilation shown below, right).                        Various Examples                          Search Interest     External References  [1] YouTube – mgmtmusic [2] YouTube – David Dean Burkhart [3] YouTube – mgmtmusic [4] Spotify – MGMT [5] TikTok – anti.audios [6] TikTok – hudsoncosplay [7] TikTok – little dark age by MGMT [8] YouTube – TIK TOK in the world [9] YouTube – Little TikTok Compilation      Latest Editorial And News       Woman's Public Freakout In Tim Horton's Again Rallies Internet Behind Service Industry Workers        Rapper DMX In Vegetative State After Heart Attack        Top TV Memes: The Best Meme Formats From 'Stranger Things'        After Addison Rae Backlash, Fallon Invites TikTok Dance Creators Onto Show"
22,Mohammad Rajab Wali / Joe Biden Wake Up,https://i.kym-cdn.com/entries/icons/original/000/036/911/cover12.png,[],Unknown,2021-04-01T18:10:50-04:00,975,0,0,0,[Work in progress],,"Top entries this week       Fluffy Ponies        Vinesauce        Emergence (Metamorphosis)        Creepy Chan (Allison Harvard)       Origin  Spread Various Examples                          Search Interest     External References  [1] TikTok – @user3622465298914      Latest Editorial And News       Woman's Public Freakout In Tim Horton's Again Rallies Internet Behind Service Industry Workers        Rapper DMX In Vegetative State After Heart Attack        Top TV Memes: The Best Meme Formats From 'Stranger Things'        After Addison Rae Backlash, Fallon Invites TikTok Dance Creators Onto Show"
23,Stop Posting About Among Us,https://i.kym-cdn.com/entries/icons/original/000/036/910/cover11.jpg,"['Exploitable', 'Viral Video']",2021,2021-04-01T16:50:17-04:00,6673,69,1,18,"Stop Posting About Among Us refers to a viral rant about an overabundance of Among Us memes recorded by TikTok user biggayrapper. In March 2021, the rant became the subject of several remixes and edits that used it as an exploitable.","On February 21st, 2021, following the viral popularity of ironic Among Us memes such as When the Imposter Is Sus, Amogus and Things That Look Like Among Us, TikTok[1] user biggayrapper recorded a rant about an overabundance of Among Us memes (shown below). The video received 32,000 views and 7,300 likes in five days[2] and over 384,300 views and 109,300 likes in five weeks.","Top entries this week       Fluffy Ponies        Vinesauce        Emergence (Metamorphosis)        Creepy Chan (Allison Harvard)       Origin On February 21st, 2021, following the viral popularity of ironic Among Us memes such as When the Imposter Is Sus, Amogus and Things That Look Like Among Us, TikTok[1] user biggayrapper recorded a rant about an overabundance of Among Us memes (shown below). The video received 32,000 views and 7,300 likes in five days[2] and over 384,300 views and 109,300 likes in five weeks.   Stop posting about Among Us! I'm tired of seeing it! My friends on TikTok send me memes, on Discord it's fucking memes! I was in a server, right? And all of the channels are just Among Us stuff. I showed my champion underwear to my girlfriend and the logo, I flipped it and I said, ""Hey, babe, when the underwear is sus!"" Haha, ding ding ding ding ding ding ding, ding-ding-ding! I fucking looked at a trashcan and I said, ""That's a bit sussy!"" I looked at my penis, I think of an astronaut's helmet and I go, ""Penis? More like pen-sus!"" Aaaaaaargh!                     Spread On February 23rd, 2021, YouTube[3] user Keaton21 reuploaded the TikTok to the platform, where it accumulated over 1.2 million views in one month. On February 25th, Redditor[4] xxlightheadxx posted the video to /r/pyrocynical subreddit where it gained over 6,100 upvotes in one month. On February 26th, biggayrapper acknowledged the spread of his rant as a meme in a tweet.[2] On March 3rd, 2021, YouTube[5] user Daniloxidado posted an Ace Attorney edit of the meme that gained over 45,700 views in one month (shown below, left). On March 4th and 5th, content creator MarioIsBroken[6][7] uploaded a Super Mario version of the meme to Twitter and YouTube, where it gained over 44,400 and over 919,000 views, respectively (YouTube version shown below, right).     In the following month, more remixes and edits of the video were posted online, primarily on YouTube. Additionally, the video was reedited into rants about other viral memes. For example, on March 23rd, 2021, YouTuber[8] Triple-Q made a meme about ""Gangnam Style"" that gained over 74,000 views in one week.                    Various Examples                          Search Interest     External References  [1] TikTok – @biggayrapper [2] Twitter – @BigGayRapper [3] YouTube – stop posting about among us [4] Reddit – I'm going mental please stop posting among us [5] YouTube – STOP POSTING ABOUT AMONG US – Ace Attorney version [6] Twitter – @MarioIsBroken [7] YouTube – Stop Posting About Among Us – Mario Edition [8] YouTube – STOP POSTING ABOUT GANGNAM STYLE      Latest Editorial And News       Woman's Public Freakout In Tim Horton's Again Rallies Internet Behind Service Industry Workers        Rapper DMX In Vegetative State After Heart Attack        Top TV Memes: The Best Meme Formats From 'Stranger Things'        After Addison Rae Backlash, Fallon Invites TikTok Dance Creators Onto Show"
24,All Of The Lights,https://i.kym-cdn.com/entries/icons/original/000/036/909/Untitled.png,['Exploitable'],2019,2021-04-01T16:16:28-04:00,402,7,0,0,[Request editorship to help expand],,"Top entries this week       Fluffy Ponies        Vinesauce        Emergence (Metamorphosis)        Creepy Chan (Allison Harvard)       Origin                    Latest Editorial And News       Woman's Public Freakout In Tim Horton's Again Rallies Internet Behind Service Industry Workers        Rapper DMX In Vegetative State After Heart Attack        Top TV Memes: The Best Meme Formats From 'Stranger Things'        After Addison Rae Backlash, Fallon Invites TikTok Dance Creators Onto Show"
