,name,image,type,origin_year,date_added,views,videos,photos,comments,about,origin,other_text
7,Sound Variations,https://i.kym-cdn.com/entries/icons/original/000/036/927/coffin_dance_sound_variations.jpg,"['Cliché', 'Snowclone', 'Sound Effect']",2018,2021-04-04T12:12:29-04:00,183,10,0,2,"Sound Variations refers to a trend of YouTube videos that showcases edits of popular sound effects or music excerpts over a specified period of time. The title usually tends to be ""X Sound Variations in X Seconds/Minutes"".","The first known video in this fashion is ""25 Roblox Death Sound Variations in 60 Seconds"" published by Memetastic on February 15, 2018. The video gained 32 million views in three years, becoming the second most viewed Sound Variations video on YouTube.[1]","Top entries this week       Fluffy Ponies        Vinesauce        Emergence (Metamorphosis)        Creepy Chan (Allison Harvard)       Origin The first known video in this fashion is ""25 Roblox Death Sound Variations in 60 Seconds"" published by Memetastic on February 15, 2018. The video gained 32 million views in three years, becoming the second most viewed Sound Variations video on YouTube.[1]  Spread Memetastic would continue to upload for some time and the trend would become quite popular on YouTube, especially around late 2019-2020. A video that likely influenced the popularity of the trend was a video called oof.exe, which featured edits of the death sound from Roblox, but progressively making them more and more unrecognizable and eccentric. It was published on March 6, 2018 and garnered 3.9 million views in three years.[2]  A sound variations video was published by Igorek Tv on June 30, 2019. It was called ""62 Variations Pizza sound in Roblox"" and garnered 1 million views in over a year.[3] On November 3, 2019, Disorb would publish ""18 Mac Startup Sound Variations In 60 Seconds"". It garnered 493 thousand views in a year.[4]    The trend would continue to grow, with many YouTubers, often single-purpose YouTubers, would publish a sound variations video related to the trend that was popular at the time. The most popular sound variations video as of April 2021 is a video by DampFijiWater, which was posted on April 11, 2020 and garnered 44 million views in a year.[5]                     Various Examples                          External references [1] 25 Roblox Death Sound Variations in 60 Seconds [2] oof.exe [3] 62 Variations Pizza sound in Roblox [4] 18 Mac Startup Sound Variations In 60 Seconds [5] 25 Coffin Dance (Astronomia) Sound Variations in 60 Seconds Search Interest          Latest Editorial And News       Woman's Public Freakout In Tim Horton's Again Rallies Internet Behind Service Industry Workers        Rapper DMX In Vegetative State After Heart Attack        Top TV Memes: The Best Meme Formats From 'Stranger Things'        After Addison Rae Backlash, Fallon Invites TikTok Dance Creators Onto Show"
8,Cocomelon - Nursery Rhymes,https://i.kym-cdn.com/entries/icons/original/000/036/926/5459248-youtube-tv-png-png-download-cocomelon-nursery-rhymes-free-png-nursery-rhyme-png-920_876.jpg,[],2018,2021-04-03T19:31:47-04:00,372,5,0,5,"Cocomelon (formerly ABCkidTV (2013–2018) and ThatsMEonTV (2005–2013) is an American YouTube channel and streaming media show acquired by the British company Moonbug Entertainment and maintained by the American company Treasure Studio. Cocomelon specializes in 3D animation videos of both traditional nursery rhymes and their own original children's songs. As of July 2020, they are the most-viewed YouTube channel in the United States and second most-viewed channel in the world, behind Indian record label T-Series. They are also the most-subscribed children's channel in the world and the third most-subscribed channel in the world, behind T-Series and PewDiePie.",Videos,"Top entries this week       Fluffy Ponies        Vinesauce        Emergence (Metamorphosis)        Creepy Chan (Allison Harvard)       History Videos ThatsMEonTV On September 1, 2006, Cocomelon was created on YouTube to provide viewers with free education. Then known as ThatsMEonTV, the channel uploaded two versions of the alphabet song to YouTube on their first day.[10] The channel uploaded their third video 9 months later, titled ""Learning ABC Alphabet – Letter ""K"" -- Kangaroo Game"". Most videos on the channel taught the alphabet with a typical length of between one and two minutes.                    ABCkidTV In 2013, the ABCkidTV era introduced a new intro and logo. The logo showed a TV with a ladybug on the upper left corner. The channel began remastering older videos followed by a transition from alphabet videos to nursery rhymes and longer video lengths. Within a few years the channel introduced 3D animation, with their first 3D character being used in Twinkle Twinkle Little Star on April 8, 2016. The video featured a 3D flying star guiding 2D characters through the sky. Towards the end of 2016, 3D animation video uploads became more frequent and longer, with some videos using motion capture technology.                    Present day In summer 2018, the company rebranded again to Cocomelon, introducing a new intro and outro to all their videos. They also added the present-day logo of a watermelon stylized to resemble a traditional box TV set, while retaining the ladybug as part of the opening and closing sequences.  In April 2019, The Wall Street Journal estimated Cocomelon's yearly ad revenue at $120 million] In late 2020, Cocomelon added content in Spanish and Portuguese.                    Rise in popularity After nine years on YouTube, Cocomelon reached 1 million subscribers on May 16, 2016. Half a month later, the channel reached one billion views. The following two years continued to grow with nearly 400,000 subscribers per month to ten million subscribers and gained seven billion views. They started increasing rapidly with the release of ""No No"" Bedtime Song which was released in July 2017 and became their most viewed video, currently over 1 billion views. Cocomelon had the second largest YouTube channel subscriptions gain in 2019 with an increase of over 36 million, ending the year on 67.4 million in channel subscriptions. In 2018, YouTube's algorithm recommended Cocomelon's video ""Bath Song + More Nursery Rhymes & Kids Songs"" 650 times ""among the 696,468 suggestions that Pew Research Center tracked"" making it the most recommended video on YouTube. As of March 2021, that video has received over 3.8 billion views on YouTube, making it the 10th-most viewed video on the site. In addition, their second most popular video, ""Wheels on the Bus"", has received over 2.7 billion views. In May and June 2019, Cocomelon received 2.5 billion video views, averaging 83 million daily viewers. Comparatively, the ""major four TV broadcast networks averaged just 13 million viewers daily during the TV season"". In July 2019, YouTube changed its algorithm after the Federal Trade Commission raised concerns over child safety. Multiple children's channels were affected, including Cocomelon, which ""dropped from 575 million views the week before the change, to 436 million the week of, to 307 million the week after, and 282 million the week after that"". On December 12, 2020, Cocomelon became the third YouTube channel in the world to get 100 million subscribers. Cocomelon's videos also achieved popularity outside YouTube; in September 2020 Netflix ranked Cocomelon as its third most popular show.                    Are We There Yet? On Feb 28, 2018, Cocomelon Upload The Video Are We There Yet? | CoComelon Nursery Rhymes & Kids Songs With +500 million views  On 10 Dez, 2018 SolarPhoofy Uploaded the first know ''Are We There Yet?'' meme, the video have 1 million views  The Most Viewed ''Are We There Yet?'' meme is Uploaded by DepartedRX With 1.2 million views  in the meme have the song ''Are We There Yet?'' by Cocomelon and when in the song the Father Says let's play a game the sound bursts with a car falling                    PewDiePie Vs Cocomelon On June 1, 2020, PewDiePie made his first video on Cocomelon, discussing about how they might end up being the biggest channel on YouTube. He mentioned T-Series and wanted to ""team-up"" with them to battle against Cocomelon. In addition, he said he would make a diss track on Cocomelon similar to the ones he made on T-Series.                    Cocomelon Parody Intros In PewDiePie's first video on Cocomelon, he mentioned how he wanted to get as popular as Cocomelon and decided to start putting in intro parodies of Cocomelon's intro into his videos. They were similar to the actual intros used in Cocomelon's videos but instead feature Felix's voice shouting ""PewDiePie!"" as well as the name PewDiePie in a similar font to that of what Cocomelon uses. Many fans of PewDiePie also contributed, making their own logo parodies using animation. As a result, many compilations of these intro parodies were made which became quite popular.                    Disstrack It is predicted Cocomelon will surpass PewDiePie at some point in 2021, becoming the second-most subscribed YouTube channel.In response to this, PewDiePie released Coco, a diss track targeted at Cocomelon on February 14, 2021. The video has since been removed from YouTube for harassment and cyberbullying policy.                    Search Interest                       Latest Editorial And News       Woman's Public Freakout In Tim Horton's Again Rallies Internet Behind Service Industry Workers        Rapper DMX In Vegetative State After Heart Attack        Top TV Memes: The Best Meme Formats From 'Stranger Things'        After Addison Rae Backlash, Fallon Invites TikTok Dance Creators Onto Show"
9,Reporter Laughing at Cat,https://i.kym-cdn.com/entries/icons/original/000/036/925/reporter_laugh_at_cat.png,"['Reaction', 'Viral Video']",2013,2021-04-03T18:20:21-04:00,494,9,1,0,"Reporter Laughing at Cat refers to video remix series based on a segment from the morning show TODAY in which reporter Karl Stefanovic laughs uncontrollably while interviewing Grumpy Cat. Online, it was used by adding his reaction to various videos or photos of other cats or viral videos.","On August 19th, 2013, the verified YouTube[1] channel for the Australian talk show Today uploaded a video titled ""Reporter can't stop laughing at Grumpy Cat"". In the video, the reporter Karl Stevanofic interviews Grumpy Cat. When he begins to ask questions, he's suddenly starts laughing uncontrollably after looking at Grumpy Cat's face. The video received more than 3.1 million views in 8 years (shown below).","Top entries this week       Fluffy Ponies        Vinesauce        Emergence (Metamorphosis)        Creepy Chan (Allison Harvard)       Origin On August 19th, 2013, the verified YouTube[1] channel for the Australian talk show Today uploaded a video titled ""Reporter can't stop laughing at Grumpy Cat"". In the video, the reporter Karl Stevanofic interviews Grumpy Cat. When he begins to ask questions, he's suddenly starts laughing uncontrollably after looking at Grumpy Cat's face. The video received more than 3.1 million views in 8 years (shown below).                     Spread In early December 2020, the video grew in popularity as a reaction video. For example, on December 7th, 2020, YouTube[3] user bluch uploaded video titled ""Reporter Can't Stop Laughing At Big Floppa."" The video received more than 36,000 views in less than four months (shown below, left). On December 10th, 2020, YouTube[2] user Memezulu uploaded video titled ""News Anchor Laughs at Cat for 23 Seconds."" The video received more than 411,000 views in less than four months (shown below, right).     The video was also popular in Facebook. For example on December 9th, 2020, Facebook[4] user Logan Mounger uploaded the video, receiving more than 1,600 shares and 660 reactions in less than four months (shown below, left). On December 18th, 2020, Facebook[5] page ""Doge Cubao 3: Art Hoe Hunter"" uploaded a version that sees the anchor laughing at Doge. The video received more than 800 shares and 700 reactions in less than four months (screenshot below, right).                        Various Examples                         Search Interest     External References  [1] YouTube – Reporter can't stop laughing at Grumpy Cat [2] YouTube – News Anchor Laughs at Cat For 23 Seconds [3] YouTube – Reporter Can't Stop Laughing At Big Floppa [4] Facebook – Logan Maunger [5] Facebook – Doge Cubao 3 Art Hoe Hunter      Latest Editorial And News       Woman's Public Freakout In Tim Horton's Again Rallies Internet Behind Service Industry Workers        Rapper DMX In Vegetative State After Heart Attack        Top TV Memes: The Best Meme Formats From 'Stranger Things'        After Addison Rae Backlash, Fallon Invites TikTok Dance Creators Onto Show"
10,Laughing Mutahar,https://i.kym-cdn.com/entries/icons/original/000/036/924/mutahar_laugh.png,"['Sound Effect', 'Viral Video']",2016,2021-04-03T15:51:49-04:00,235,6,0,0,"Laughing Mutahar refers to video reaction from YouTuber SomeOrdinaryGamers (known as Mutahar Anas) when he's laughing loudly while playing some games. Online, it was used as laughing reaction by adding it to humorous video.","On August 31st, 2016, YouTuber[1] SomeOrdinaryGamers uploaded video titled ""WEEABOO ""SCREAMER"" CRINGE!"". In the video, Mutahar start to playing Japanese creepy games. While the jumpscare out, he's just laughing loudly instead of shock. The video received more than 1.3 million views in 4 years (shown below).","Top entries this week       Fluffy Ponies        Vinesauce        Emergence (Metamorphosis)        Creepy Chan (Allison Harvard)       Origin On August 31st, 2016, YouTuber[1] SomeOrdinaryGamers uploaded video titled ""WEEABOO ""SCREAMER"" CRINGE!"". In the video, Mutahar start to playing Japanese creepy games. While the jumpscare out, he's just laughing loudly instead of shock. The video received more than 1.3 million views in 4 years (shown below).  On July 20th, 2020, YouTube[2] user SomeRandomPiggo uploaded cropped version when Mutahar laughing loudly. The video received more than 2.8 million views in 1 year (shown below).                     Spread Please help me research it Mutahar's Respond On December 9th, 2020, SomeOrdinaryGamers[3] uplaoded video titled ""I Have The Best Laugh On TikTok…"" as his respond to the meme that goes popular on TikTok. The video received more than 777,000 views (shown below).  Various Examples                          Search Interest     External References  [1] YouTube – WEEABOO 'SCREAMER' CRINGE! [2] YouTube – SomeRandomPiggo [3] YouTube – I Have The Best Laugh On TikTok…      Latest Editorial And News       Woman's Public Freakout In Tim Horton's Again Rallies Internet Behind Service Industry Workers        Rapper DMX In Vegetative State After Heart Attack        Top TV Memes: The Best Meme Formats From 'Stranger Things'        After Addison Rae Backlash, Fallon Invites TikTok Dance Creators Onto Show"
11,Paris Hilton,https://i.kym-cdn.com/entries/icons/original/000/036/923/parishiltoncrop.jpg,"['Businessperson', 'Influencer', 'Activist', 'Actor', 'Model', 'Musician', 'TV Personality']",2003,2021-04-03T11:39:45-04:00,214,2,1,1,Completing now,,"Top entries this week       Fluffy Ponies        Vinesauce        Emergence (Metamorphosis)        Creepy Chan (Allison Harvard)       Career Online History The Sex Tapes Selfie Culture ""."" h7. New Ventures cooking show host crypto influencer                   Latest Editorial And News       Woman's Public Freakout In Tim Horton's Again Rallies Internet Behind Service Industry Workers        Rapper DMX In Vegetative State After Heart Attack        Top TV Memes: The Best Meme Formats From 'Stranger Things'        After Addison Rae Backlash, Fallon Invites TikTok Dance Creators Onto Show"
12,Dr. Brandy Goldberg,https://i.kym-cdn.com/entries/icons/original/000/036/922/Screenshot_2021-04-03_101036.png,[],Parody,2021-04-03T10:22:55-04:00,260,0,0,0,"Dr. Brandy Goldberg is a troll that originated from reddit with catchphrases such as ""I have a PhD"" or ""My name is Dr. Brandy Goldberg, google me if you want to read my autobiography"". It is a satire account that acts condescendingly as to create a humorous atmosphere, but often fails as it suffers from realism.",,"Top entries this week       Fluffy Ponies        Vinesauce        Emergence (Metamorphosis)        Creepy Chan (Allison Harvard)      Latest Editorial And News       Woman's Public Freakout In Tim Horton's Again Rallies Internet Behind Service Industry Workers        Rapper DMX In Vegetative State After Heart Attack        Top TV Memes: The Best Meme Formats From 'Stranger Things'        After Addison Rae Backlash, Fallon Invites TikTok Dance Creators Onto Show"
13,Leaf Fluttering in Wind Emoji 🍃,https://i.kym-cdn.com/entries/icons/original/000/036/920/leaf_emojicover.jpg,"['Emoticon', 'Slang']",2010,2021-04-02T15:06:28-04:00,209,0,3,0,"Leaf Fluttering in Wind Emoji (🍃) is an emoji depicting a green leaf fluttering in the wind, as if plucked off a branch while still alive. In 2020, TikTokers popularized using the emoji to represent marijuana.","The Leaf Fluttering in Wind emoji was first added to Unicode version 6.0 in 2010, before being added to Emoji 1.0 in 2015. In the years immediately following its release the emoji didn't have a specific use, mainly used in posts and text talking about gardening, nature, and the seasons.","Top entries this week       Fluffy Ponies        Vinesauce        Emergence (Metamorphosis)        Creepy Chan (Allison Harvard)       Origin The Leaf Fluttering in Wind emoji was first added to Unicode version 6.0 in 2010, before being added to Emoji 1.0 in 2015. In the years immediately following its release the emoji didn't have a specific use, mainly used in posts and text talking about gardening, nature, and the seasons. Demand for a marijuana leaf emoji is not uncommon, leading people to find various alternatives. For example, on April 21st, 2020, Twitter[1] user @jeremyburge shared a graph showing that searches for ""weed"" on Emojipedia were up massively that month (shown below).    Other alternative emojis for marijuana include the Broccoli Emoji (🥦), often in combination with the Gust emoji (💨). Code for Marijuana It's unknown exactly when people began using the 🍃 emoji to represent marijuana, but people began using it as such the year after it was added as an emoji. For example, a number of posts using the emoji when talking about weed can be found on Twitter starting in 2011 (examples shown below).     The practice began increasing in popularity starting around 2018. For example, on December 6th, 2018, the Twitter[2] account for Vice shared an article announcing weed's legalization in Michigan, using the leaf emojis in the post (shown below).   🚨 Weed is legal in Michigan as of today 🍃🍃 pic.twitter.com/wReUdA4MIh— VICE (@VICE) December 6, 2018                       Spread TikTok The use of the emoji as a symbol for marijuana was heavily popularized on TikTok over the course of 2020 leading into 2021. For example, videos under the hashtag #🍃 have collected over 350 million combined views, with some examples uploaded as early as May 2020 (early examples from the hashtag shown below, left and right).                       Various Examples                    Search Interest     External References  [1] Twitter – Searches for 'weed' on Emojipedia yesterday [2] Twitter – Weed is legal      Latest Editorial And News       Woman's Public Freakout In Tim Horton's Again Rallies Internet Behind Service Industry Workers        Rapper DMX In Vegetative State After Heart Attack        Top TV Memes: The Best Meme Formats From 'Stranger Things'        After Addison Rae Backlash, Fallon Invites TikTok Dance Creators Onto Show"
14,Chapstick Challenge,https://i.kym-cdn.com/entries/icons/original/000/036/919/Screen_Shot_2021-04-02_at_2.18.05_PM.png,['Social Game'],2021,2021-04-02T14:53:46-04:00,4246,0,2,16,"Chapstick Challenge refers to a suicide-ideation trend on TikTok in which a person shows themself opening a tube of lip balm and implying that when the tube is finished, they will commit suicide. While it is unclear if any deaths have resulted from the trend, its existence sparked backlash from people who believe the trend promotes suicide and may be a means to manipulate others into giving the poster attention. It is not to be confused with a similar ""Chapstick Challenge"" in which two people kiss and guess the other person's flavor of chapstick.","It is unclear when the Chapstick Challenge began. The earliest mention of the trend on Twitter was posted on March 24th, 2021 by user @kaitlynlaslett[1] (shown below).","Top entries this week       Fluffy Ponies        Vinesauce        Emergence (Metamorphosis)        Creepy Chan (Allison Harvard)       Origin It is unclear when the Chapstick Challenge began. The earliest mention of the trend on Twitter was posted on March 24th, 2021 by user @kaitlynlaslett[1] (shown below).    Spread It is unclear if anyone promoting the trend has actually engaged in self-harm. Videos associated with the trend are under a sound called ""Chapstick Challenge""[2] and use an edited version of the song ""The Cigarette Duet"" by Princess Chelsea. While most of the videos with the sound are from people decrying the trend, there are some videos under the sound that imply suicide. In late March, multiple publications wrote articles about the trend, including HITC,[3] Meaww[4] and Distractify.[5] Distractify posted a screenshot from an alleged sincere entry to the ""Chapstick Challenge"" posted by 0000_pain_0000, though it appears the video was deleted[6] (shown below).    Many other videos posted as a sincere part of the trend have been deleted. The Daily Dot[7] identified videos by users @ashleysolis__, @just_make_it_stop and @save.me.sounds that sincerely participated in the trend, but all the videos were deleted. @save.me.sounds later posted that they had stopped doing the challenge.               Search Interest                External References  [1] Twitter – kaitlynlaslett [2] TikTok – Chapstick Challenge [3] HITC – WHAT IS THE CHAPSTICK CHALLENGE ON TIKTOK? WARNING ABOUT DANGEROUS TREND [4] Meaww – What is the 'chapstick challenge'? Viral TikTok trend uses lip balm to promote suicidal thoughts among teens [5] Distractify – The ChapStick Challenge on TikTok Should Not Be Attempted by Anyone [6] TikTok – 0000_pain_0000 (page unavailable) [7] Daily Dot – The ‘chapstick challenge’ on TikTok promotes suicidal ideation            Latest Editorial And News       Woman's Public Freakout In Tim Horton's Again Rallies Internet Behind Service Industry Workers        Rapper DMX In Vegetative State After Heart Attack        Top TV Memes: The Best Meme Formats From 'Stranger Things'        After Addison Rae Backlash, Fallon Invites TikTok Dance Creators Onto Show"
