,name,image,type,origin_year,date_added,views,videos,photos,comments,about,origin,other_text
0,Clearly You've Never Made an Omelette,https://i.kym-cdn.com/entries/icons/original/000/036/934/omelettecover.jpg,"['Catchphrase', 'Exploitable', 'Image Macro']",2015,2021-04-05T15:39:25-04:00,837,1,18,0,"Clearly You've Never Made an Omelette, alternatively spelled as Clearly You've Never Made an Omelet, refers to a line of dialogue spoken by Ultron in the 2015 Marvel film Avengers: Age of Ultron in response to Thor saying, ""nobody has to break anything."" The line became the subject of memes, particularly ironic demotivational posters, in early 2021, associated with an image of Robert Downey Jr. as Tony Stark with a smug smile on his face.","On April 13th, 2015, the Marvel film Avengers: Age of Ultron premiered in North American theatres. At one point in the film, the Avengers encounter Ultron. Before fighting, Thor says, ""Nobody has to break anything,"" to which Ultron responds, ""Clearly you've never made an omelette,"" followed by Iron Man saying, ""he beat me by one second"" (shown below).","Top entries this week       Fluffy Ponies        Vinesauce        Emergence (Metamorphosis)        Creepy Chan (Allison Harvard)       Origin On April 13th, 2015, the Marvel film Avengers: Age of Ultron premiered in North American theatres. At one point in the film, the Avengers encounter Ultron. Before fighting, Thor says, ""Nobody has to break anything,"" to which Ultron responds, ""Clearly you've never made an omelette,"" followed by Iron Man saying, ""he beat me by one second"" (shown below).  On January 11th, 2021, Instagram[1] user someweebwatchingcartoons uploaded a demotivational poster featuring a screenshot of Robert Downey Jr.'s face as Tony Stark in the Iron Man suit, smiling with a smug look of superiority, and the text, ""Clearly you've never made an omelette,"" directly referencing the scene in Age of Ultron (shown below). The image gained over 37,300 likes in three months and is the earliest known upload.    The image was reposted by a number of Instagram[2][3] accounts over the following months, helping to spread it online.                    Spread On February 13th, 2021 Twitter[7] user @fjxsu posted a demotivational poster featuring an image of Patrick Bateman from the film American Psycho with the text, ""clearly you've never hit an edgebug,"" referencing a Source engine glitch,[8] garnering over 4,000 likes and 310 retweets in just under two months (shown below).    On March 25th, Instagram[4] user @mememonk_ posted a demotivational poster (shown below) featuring actor Anthony Mackie as Hawkeye flying through the air with a caption reading, ""Clearly you've never made daddy a sandwich,"" referencing a controversial clip that was going viral at the time of Mackie talking about gender roles in 2019 where he uses the line ""make daddy a sandwich."" The post gained over 31,200 likes in just under two weeks.    On March 29th, Instagram[5] user @_kingorange posted a comic combining two versions of the meme along with the Robert Downey Jr.'s Comments format, garnering over 8,800 likes in a week (shown below, left). On April 1st, Instagram[6] user @soldier4smash posted a new version of the meme featuring the Heavy from Team Fortress 2, garnering over 11,000 likes in four days (shown below, right).                        Various Examples         Search Interest [Unavailable]                    External References  [1] Instagram – Berserk is a top 5 manga [2] Instagram – ricecrispyeet [3] Instagram – sexualavacado [4] Instagram  – Anthony mackie look like he got something to tell us [5] Instagram  – cemented itself [6] Instagram  – Don't forget to [7] Twitter – fjxsu [8] Wiki.sourceruns – edgebug      Latest Editorial And News       Woman's Public Freakout In Tim Horton's Again Rallies Internet Behind Service Industry Workers        Rapper DMX In Vegetative State After Heart Attack        Top TV Memes: The Best Meme Formats From 'Stranger Things'        After Addison Rae Backlash, Fallon Invites TikTok Dance Creators Onto Show"
1,Y’all Wanna Hear A Story About Why Me & This Bitch Here Fell Out?!,https://i.kym-cdn.com/entries/icons/original/000/036/933/Screen_Shot_2021-04-05_at_2.54.42_PM.png,['Catchphrase'],2015,2021-04-05T15:12:50-04:00,2542,0,11,1,"Y’all Wanna Hear A Story About Why Me & This Bitch Here Fell Out?! refers to a series of tweets parodying the beginning of The Zola Story, which begins, ""Y’all wanna hear a story about why me & this bitch here fell out?! It’s kinda long but full of suspense."" After the release of the trailer for the film adaptation of The Zola Story in 2021, which also opens with the quote, Twitter users began parodying the quote by applying it to couples from various pieces of media that have a falling out.","On October 27th, 2015, Twitter user @_zolarmoon began her now-iconic thread with the phrase, ""Y’all wanna hear a story about why me & this bitch here fell out?! It’s kinda long but full of suspense"" shown below).","Top entries this week       Fluffy Ponies        Vinesauce        Emergence (Metamorphosis)        Creepy Chan (Allison Harvard)       Origin On October 27th, 2015, Twitter user @_zolarmoon began her now-iconic thread with the phrase, ""Y’all wanna hear a story about why me & this bitch here fell out?! It’s kinda long but full of suspense"" shown below).    On March 31st, 2021, the trailer for @Zola released. It also featured the quote at the beginning of the trailer.  On April 2nd, 2021, Twitter user @commieeangel[1] posted pictures of pop singers Marina and Charlie XCX with the quote, gaining over 300 retweets and 3,400 likes (shown below).                       Spread The meme began growing more widespread on April 4th, 2021, when Twitter user @jezfrompeepshow[2] made the joke using characters from The Social Network, gaining over 690 retweets and 8,200 likes (shown below, left). User @jeremyoharris[3] quote-tweeted the post and made the same joke using characters from Wicked, gaining over 170 retweets and 2,100 likes (shown below, right).     Over the following days, multiple other Twitter users got in on the joke. For example, on April 5th, Twitter user @hunteryharris[4] made the joke using characters from Succession, gaining over 120 retweets and 950 likes (shown below, left). User @vamp1rebride[5] made the joke using Tyler Durden from Fight Club, gaining over 20 retweets and 170 likes (shown below, right).                        Various Examples         Search Interest Unavailable                    External References  [1] Twitter – @commieeangel [2] Twitter – @jezfrompeepshow [3] Twitter – @jeremyoharris [4] Twitter – @hunteryharris [5] Twitter – @vamp1rebride      Latest Editorial And News       Woman's Public Freakout In Tim Horton's Again Rallies Internet Behind Service Industry Workers        Rapper DMX In Vegetative State After Heart Attack        Top TV Memes: The Best Meme Formats From 'Stranger Things'        After Addison Rae Backlash, Fallon Invites TikTok Dance Creators Onto Show"
2,Mechagodzilla,https://i.kym-cdn.com/entries/icons/original/000/036/932/mechacover.jpg,['Character'],1974,2021-04-05T14:56:16-04:00,122,0,0,0,"Mechagodzilla is a mecha version of Godzilla featured in the Godzilla franchise. The character, which closely resembles Godzilla and is considered one of its archenemies, first appeared in the 1974 film Godzilla vs. Mechagodzilla and has since become a fan favorite, appearing in numerous related media since, including films, video games, comic books, and more.",First Appearance,"Top entries this week       Fluffy Ponies        Vinesauce        Emergence (Metamorphosis)        Creepy Chan (Allison Harvard)       Origin First Appearance On March 21st, 1974, the 14th film in the Godzilla franchise, titled Godzilla vs. Mechagodzilla, premiered in Japan, featuring the first appearance of Mechagodzilla. In the film, Mechagodzilla is postured as an alien superweapon, made out of a type of space metal by an ape-like species of extraterrestrials bent on taking over Earth. Mechagodzilla is equipped with a wide array of weaponry, made to be able to fight Godzilla. The film was released in North America in 1977 as Godzilla vs, the Bionic Monster.                     Spread Mechagodzilla has appeared in a total of eight Godzilla films since 1974, as well as 2018's Ready Player One film adaptation (clip shown below).  The design of Mechagodzilla changes significantly with each appearance. On August 4th, 2018, YouTube channel Evolution TV posted a video showing Mechagodzilla in various appearances, garnering over 2 million views in two years (shown below).  Godzilla vs. Kong Mechagodzilla makes an appearance in the 2021 film Godzilla vs. Kong as a primary antagonist, revealed in a trailer released in March of that year (shown below).                     Various Examples                    Search Interest     External References     Latest Editorial And News       Woman's Public Freakout In Tim Horton's Again Rallies Internet Behind Service Industry Workers        Rapper DMX In Vegetative State After Heart Attack        Top TV Memes: The Best Meme Formats From 'Stranger Things'        After Addison Rae Backlash, Fallon Invites TikTok Dance Creators Onto Show"
3,The Flash Looking at Superman,https://i.kym-cdn.com/entries/icons/original/000/036/931/flash-1.jpg,['Image Macro'],2017,2021-04-05T12:49:48-04:00,777,0,12,0,"The Flash Looking at Superman is an image macro meme featuring two screenshots from the 2017 superhero film Justice League. The meme features the character Superman catching fellow superhero the Flash attempting to sneak behind him in a fight. Online, people use the two images to express feelings surprised obstruction.","On November 17th, 2017, Warner Bros. released the film Justice League in the United States.[1] In the film, the titular Justice League resurrects the character Superman (portrayed by Henry Cavill), who awakens confused, angry and defensive. As a result, the Justice League attempts to quell his rage by fighting him, and when the Flash (portrayed by Ezra Miller) attempts to sneak around him, Superman turns his sights on him (shown below).","Top entries this week       Fluffy Ponies        Vinesauce        Emergence (Metamorphosis)        Creepy Chan (Allison Harvard)       Origin On November 17th, 2017, Warner Bros. released the film Justice League in the United States.[1] In the film, the titular Justice League resurrects the character Superman (portrayed by Henry Cavill), who awakens confused, angry and defensive. As a result, the Justice League attempts to quell his rage by fighting him, and when the Flash (portrayed by Ezra Miller) attempts to sneak around him, Superman turns his sights on him (shown below).  On November 21st, 2017, Tumblr [2] user mikebay16 posted a meme from @dccomicfeed Instagram account. The post received more than 800 notes in less than four years (shown below).                       Spread The meme saw sporadic usage over the next for years. For example, Redditor SeniorLad shared a variation from the Marvel Shieldposting Facebook in the /r/4panelcringe[3] subreddit (shown below, left). On April 3rd, 2021, Redditor Metalloid_Emon shared an object labeling variation of the meme in the /r/HolUp[4] subreddit. The post received more than 70,000 points (80% upvoted) and 550 comments in less than two weeks (shown below, center). On April 5th, Redditor karvina_42 shared a variation in the /r/dankmemes[5] subreddit. The post received more than 67,000 points (93% upvoted) and 400 comments in less than 24 hours (shown below, right).                         Various Examples          Template    Search Interest Not available.                    External References  [1] IMDB – Justice League [2] Tumblr – mikebay16's Post [3] Reddit – /r/4panelcringe [4] Reddit – /r/holup [5] Reddit – /r/dankmemes      Latest Editorial And News       Woman's Public Freakout In Tim Horton's Again Rallies Internet Behind Service Industry Workers        Rapper DMX In Vegetative State After Heart Attack        Top TV Memes: The Best Meme Formats From 'Stranger Things'        After Addison Rae Backlash, Fallon Invites TikTok Dance Creators Onto Show"
4,"Vocoded To ""Gangsta's Paradise""",https://i.kym-cdn.com/entries/icons/original/000/036/930/vocodecover.jpg,"['Remix', 'Song']",2019,2021-04-05T12:34:02-04:00,470,41,0,1,"Vocoded To ""Gangsta's Paradise"" refers to a video edit trend in which a vocoder effect is used over various viral videos and clips to make them match the tune of Coolio's 2010 song ""Gangsta's Paradise."" Vocoder video edits first started appearing on YouTube in 2018, with the ""Gangsta's Paradise"" versions appearing in 2019.","On February 10th, 2018, YouTuber[1] We Are Soup uploaded an edit of the viral Get Out of My Car video in which the audio is vocoded to match the tune of ""Bloody Stream"" from the anime series JoJo's Bizarre Adventure (shown below). This is the earliest known meme edit on YouTube to use the vocoder effect, garnering over 235,000 views in three years.","Top entries this week       Fluffy Ponies        Vinesauce        Emergence (Metamorphosis)        Creepy Chan (Allison Harvard)       Origin On February 10th, 2018, YouTuber[1] We Are Soup uploaded an edit of the viral Get Out of My Car video in which the audio is vocoded to match the tune of ""Bloody Stream"" from the anime series JoJo's Bizarre Adventure (shown below). This is the earliest known meme edit on YouTube to use the vocoder effect, garnering over 235,000 views in three years.  In the following years, vocoding video clips to various songs became a common practice in video edits. On May 26, 2019, YouTuber[2] Cheese Wizard posted a video in which a clip from the SpongeBob Squarepants episode ""Pizza Delivery"" is vocoded to Coolio's 2010 song ""Gangsta's Paradise,"" garnering over 2.6 million views in just under two years (shown below). This is the first vocoder meme to use the song.                     Spread Users began uploading a number of videos similar to Cheese Wizard's over the next year, in which various clips are vocoded to ""Gangsta's Paradise."" For example, on October 20th, 2019, YouTuber[3] Lightnite Productions uploaded a version of ""Asdfmovie 12"" vocoded to the song, garnering over 26,000 views in just over a year (shown below).  On July 9th, 2020, YouTuber[4] Sovereignty uploaded a video of the fight with Sans from Undertale vocoded to the song, garnering over 232,000 views in nine months (shown below, left). On September 5th, YouTuber[5] JFK Headwound uploaded a video vocoding the song to itself, garnering over 1.1 million views in seven months (shown below, right).     Videos following the trend saw a significant increase in popularity leading into early 2021, with several uploads from the first quarter of the year going viral. For example, on January 20th, YouTuber[6] Memnicus posted a version of the 64 Bits clip vocoded to the song, garnering over 3 million views in three months (shown below, left). On January 28th, YouTuber[7] Pringa uploaded a clip of Peter Griffin from Family Guy falling down the stairs with the edit, garnering over 2 million views in a comparable span of time (shown below, right).     On February 19th, 2021, YouTuber[8] Lessons In Meme Culture uploaded a video on the trend, garnering over 295,000 views in under two months (shown below).                     Various Examples                         Search Interest     External References  [1] YouTube – Get out of my car but it's vocoded to Bloody Stream [2] YouTube – Pizza Delivery but vocoded to Gangsta’s Paradise [3] YouTube – Asdfmovie 12 But It's Vocoded To Gangsta's Paradise [4] YouTube – Sans Fight But It's Vocoded To Gangsta's Paradise [5] YouTube – Gangsta's Paradise Vocoded to Gangsta's Paradise [6] YouTube – 64 bits [7] YouTube – Peter falling down the stairs vocoded to Gangsta's Paradise [8] YouTube – Why Is Everything Vocoded To Gangsta’s Paradise?      Latest Editorial And News       Woman's Public Freakout In Tim Horton's Again Rallies Internet Behind Service Industry Workers        Rapper DMX In Vegetative State After Heart Attack        Top TV Memes: The Best Meme Formats From 'Stranger Things'        After Addison Rae Backlash, Fallon Invites TikTok Dance Creators Onto Show"
5,Movie Runtime Is Actually Frustrating,https://i.kym-cdn.com/entries/icons/original/000/036/929/mortal.jpg,['Snowclone'],2021,2021-04-05T11:17:42-04:00,871,0,10,5,"Movie Runtime Is Actually Frustrating is a phrasal template based on a tweet criticizing the length of the 2021 action-fantasy film Mortal Kombat. The tweet became the subject of mockery with others replacing the Mortal Kombat with other films, indicating that these posters do not agree with the sentiment. The full template reads:","On April 4th, 2021, Twitter[1] user @CutHamad tweeted, ""This is actually frustrating. A Mortal Kombat movie not given the time to flesh out the characters is hurting me in the feels. This isn’t 2 monsters fighting each other, the characters in MK do fuckin matter."" The tweet received more than 2,200 retweets and 790 likes in less than 24 hours (shown below).","Top entries this week       Fluffy Ponies        Vinesauce        Emergence (Metamorphosis)        Creepy Chan (Allison Harvard)       Origin On April 4th, 2021, Twitter[1] user @CutHamad tweeted, ""This is actually frustrating. A Mortal Kombat movie not given the time to flesh out the characters is hurting me in the feels. This isn’t 2 monsters fighting each other, the characters in MK do fuckin matter."" The tweet received more than 2,200 retweets and 790 likes in less than 24 hours (shown below).                       Spread Following the post, people began sarcastically refuting the opinion. Twitter[2] user @BillStack_ posted a picture of several Moral Kombat characters that share a similar design. They wrote, ""i must know every single thing about these characters."" The tweet received more than 2,500 likes in less than 24 hours (shown below, left). Others began posting the template and substituting movie titles in Mortal Kombat's stead. Twitter[3] @VRTLPROS tweeted, ""This is actually frustrating. A Mr. Bean movie not given the time to flesh out the characters is hurting me in the feels. This isn’t 2 monsters fighting each other, the characters in BEAN do fuckin matter"" (shown below, left). Twitter[4] user @colecrewreview tweeted a variation using the adaptation of Mortal Kombat from 1995. They wrote, ""This is actually frustrating. A Mortal Kombat movie not given the time to flesh out the characters is hurting me in the feels. This isn’t 2 monsters fighting each other, the characters in MK do fuckin matter"" (shown below, right).                         Various Examples          Search Interest Not available.                    External References  [1] Twitter – @CutHamad's Tweet [2] Twitter – @BillStack_'s Tweet [3] Twitter – @VRTLPROS' Tweet [4] Twitter – @colecrewreview's Tweet      Latest Editorial And News       Woman's Public Freakout In Tim Horton's Again Rallies Internet Behind Service Industry Workers        Rapper DMX In Vegetative State After Heart Attack        Top TV Memes: The Best Meme Formats From 'Stranger Things'        After Addison Rae Backlash, Fallon Invites TikTok Dance Creators Onto Show"
6,Trade Offer,https://i.kym-cdn.com/entries/icons/original/000/036/928/cover1.jpg,"['Exploitable', 'Image Macro', 'Photoshop']",2020,2021-04-05T09:50:15-04:00,6786,23,20,2,"Trade Offer or Trade Request refers to a series of memes in which various barter trades are being proposed, with the memes using the 2020 NBA Draft jingle and parodying a generic trade request message in video games. The format gained popularity on TikTok in March 2021, with a video by TikToker bradeazy later becoming a source material for memes in which an extremely unequal exchange is proposed.","On November 12th, 2020, TikTok[1] user @natebellamy4 posted a video that used a jingle played during the 2020 NBA draft, captioning the video ""Trade proposal to God"" and offering on behalf of humanity to swap several living people for several dead. The TikTok received over 683,700 likes and 86,800 likes in five months (shown below).","Top entries this week       Fluffy Ponies        Vinesauce        Emergence (Metamorphosis)        Creepy Chan (Allison Harvard)       Origin On November 12th, 2020, TikTok[1] user @natebellamy4 posted a video that used a jingle played during the 2020 NBA draft, captioning the video ""Trade proposal to God"" and offering on behalf of humanity to swap several living people for several dead. The TikTok received over 683,700 likes and 86,800 likes in five months (shown below).  The video did not spark a trend until March 2021. On March 8th, TikTok[2] user tylertctv posted a video in which he proposed a trade offer to God. The video received over 440,000 views and 66,100 likes in one month (shown below).                     Spread In the following days, the format gained a significant presence on TikTok with multiple viral examples of the meme posted in mid-March. On March 8th and 9th, TikTokers[3][4][5] schmuellersvibechamber, macncheesegrrl and jushlarsen posted some of the earliest versions of the meme, gaining over 461,000, 295,000 and 1 million views, respectively (shown below, left to right).      Bradeazy's Trade Offer Prior to March 18th, TikTok[6] user bradeazy posted a version of the meme in which he, dressed in formal wear, offered nothing in exchange for a ""sloppy toppy"" (the original TikTok is no longer available). On March 18th, bradeazy reposted the video to his Instagram[7] account (reupload shown below) where it gained over 11,000 likes.  Also on March 18th, iFunny[8] user ChipSkylark reposted the video to the app, where it gained over 42,100 smiles after being featured. Between March 18th and April 3rd, 2021, bradeazy posted four additional memes using the format on TikTok.[9][10][11][12] On March 18th, iFunny[13] user Buffchicks_likedick posted the earliest derivative meme based on the video, altering the caption to include ""A Bionicals lego Set."" The post gained over 320 smiles (shown below).  The format did not see viral spread until late March 2021 when bradeazy's first video and a still image from it received viral spread.[14][15] On March 29th, an unknown user posted a Team Fortress 2 version of the meme that was widely circulated[16][17] online in the following days (shown below, left). On April 2nd, 2021, Redditor[18] Cryoffe posted a meme that gained over 17,000 upvotes in the /r/196 subreddit in four days (shown below, right).     In early April 2021, the still image from bradeazy's ""Trade Offer"" video has been widely used as an exploitable and source material for redraws.                    Various Examples          Template                       Search Interest     External References  [1] TikTok – @natebellamy4 [2] TikTok – @tylertctv [3] TikTok – @schmuellersvibechamber [4] TikTok – @macncheesegrrl [5] TikTok – @jushlarsen [6] TikTok – @bradeazy [7] Instagram – bradeazy [8] iFunny – ChipSkylark [9] TikTok – @bradeazy [10] TikTok – @bradeazy [12] TikTok – @bradeazy [13] TikTok – @bradeazy [13] iFunny – Buffchicks_likedick [14] Twitter – @anomalyskins [15] Reddit – demandingindividual [16] Funnyjunk – Yo man I like ur hat [17] Instagram – honeynut.woomy [18] Reddit – TW diplomacy be like      Latest Editorial And News       Woman's Public Freakout In Tim Horton's Again Rallies Internet Behind Service Industry Workers        Rapper DMX In Vegetative State After Heart Attack        Top TV Memes: The Best Meme Formats From 'Stranger Things'        After Addison Rae Backlash, Fallon Invites TikTok Dance Creators Onto Show"
