,name,image,type,origin_year,date_added,views,videos,photos,comments,about,origin,other_text
0,Secret Treasure Behind Waterfall,https://i.kym-cdn.com/entries/icons/original/000/036/974/cover2.jpg,[],Parody,2021-04-08T15:25:52-04:00,106,3,7,1,"Secret Treasure Behind Waterfall, also known as Cave Behind the Falls, refers to a pop culture trope according to which a secret passage can incredibly often be found behind a waterfall, with video game players often intentionally checking the waterfalls in search of secrets. Appearing in films, comics and video games, the trope gained recognition in memes which parody player reactions when nothing special is hidden behind the waterfall.","In real life, the phenomenon of shallow natural caves, referred to as rock shelters, forming behind a waterfall does commonly occur as the splashing water erodes softer rock under (diagram shown below).[1] In the terms of geology, these formations do not last long as the more resistant rock forming the ceiling of the cave and the riverbed eventually collapses.","Top entries this week       Fluffy Ponies        Emergence (Metamorphosis)        Vinesauce        Creepy Chan (Allison Harvard)       Origin In real life, the phenomenon of shallow natural caves, referred to as rock shelters, forming behind a waterfall does commonly occur as the splashing water erodes softer rock under (diagram shown below).[1] In the terms of geology, these formations do not last long as the more resistant rock forming the ceiling of the cave and the riverbed eventually collapses.    The natural phenomenon found reflection in culture, particularly in adventure literature. The earliest known example of ""cave behind the waterfall"" trope in culture is Icelandic Grettis saga Ásmundarsonar, composed approximately in late 14th century.[2][3] In the saga, murderous giants live in a cave behind a waterfall. Another early example is the Hawaiian myth of the goddess Hina, who according to the legend, lived in the cave behind Rainbow Falls on the Big Island.[4] In 1592 Chinese novel Journey to the West Sun Wukong discovers a cave after jumping through a large waterfall, with him and his monkey clan later moving into that cave.[5] In literature, the trope appears in Prisoners of the Sun (1948), The Lord of the Rings (1954) and Jurassic Park (1990) among other books. In Batman comics, one of the entrances to Batman's cave lies behind a waterfall. The trope appears in The Road to El Dorado, The Incredibles, Last of the Mohicans, The Mask of Zorro and other films. In the 1995 film Behind the Waterfall, a cave hidden behind a waterfall is a key plot part. Video Games The earliest known example of a location hidden behind a waterfall in video games is action-adventure video game The Legend of Zelda, released in February 1986.                       Spread Various Examples                    Search Interest     External References  [1] Wikipedia – Waterfall [2] TV Tropes – Cave Behind the Falls [3] Wikipedia – Grettis saga [4] HVCB – WAIĀNUENUE – RAINBOW FALLS. [5] Wikipedia – Journey to the West      Latest Editorial And News       The Kardashians Are Working Tirelessly To Scrub A Perfectly Normal Photo Of Khloé From The Web        Nathan Allebach Behind Steak-umm's Twitter Reveals How The Brand Immersed Itself In Internet Culture And Avoided Becoming ‘How Do You Do Fellow Kids?’        20 Bosses Of Peak Performance, Can You Defeat Them?        Serious Doubts Are Raised Over Infowars Video Claiming Alex Jones Is Stopping A Child Kidnapping"
1,Dancing Zemo,https://i.kym-cdn.com/entries/icons/original/000/036/973/Screen_Shot_2021-04-08_at_2.34.00_PM.png,"['Remix', 'Viral Video']",2021,2021-04-08T15:08:17-04:00,870,0,0,3,Dancing Zemo refers to a clip from Falcon and the Winter Soldier of Baron Helmut Zemo dancing in a club. The clip spread on Twitter as users added humorous music to the scene.,"On April 2nd, 2021, the Falcon and the Winter Soldier episode ""Power Broker""[1] aired. The episode features a scene of Baron Helmut Zemo dancing in a club (shown below).","Top entries this week       Fluffy Ponies        Emergence (Metamorphosis)        Vinesauce        Creepy Chan (Allison Harvard)       Origin On April 2nd, 2021, the Falcon and the Winter Soldier episode ""Power Broker""[1] aired. The episode features a scene of Baron Helmut Zemo dancing in a club (shown below).  Spread The day the episode aired, Twitter user @bradwhipple posted a GIF of the moment to Twitter, gaining over 100 likes (shown below, top). On April 3rd, 2021, the Twitter account @ZemoDancingTo[2] launched, a gimmick account dedicated to posting remixes of the scene with numerous songs. Some popular examples include a remix featuring ""Hip To Be A Square"" by Huey Lewis and The News (shown below, bottom).   no thoughts, head empty, just zemo dancing #FalconAndWinterSoldier pic.twitter.com/7z9IETF8De— Braddington 3 (@bradwhipple) April 2, 2021      Huey Lewis and the News – Hip to be Square pic.twitter.com/5Z0dlkCo9N — zemo dancing to (@zemodancingto) April 6, 2021    The meme pointed out by Inverse[3] as a symptom of problems with the Marvel Cinematic Universe, writing, ""It’s a tough act to buy when this is also the guy who split the Avengers in half, thereby leaving all of Earth unprepared for Thanos’ arrival.""                    Various Examples   LOONA – Why Not? pic.twitter.com/CPzRpTXYjU — zemo dancing to (@zemodancingto) April 8, 2021      Ducktales 2017 theme pic.twitter.com/A9DVck0Wi6 — zemo dancing to (@zemodancingto) April 8, 2021      Friday Night – Yakuza series pic.twitter.com/kLNvig3G2Y — zemo dancing to (@zemodancingto) April 8, 2021      i’m still standing – elton john pic.twitter.com/w3OAkjDnxx — zemo dancing to (@zemodancingto) April 8, 2021                       Search Interest                        External References  [1] IMDb – Power Broker [2] Twitter – @zemodancingto [3] Inverse – FALCON AND WINTER SOLDIER’S DANCING ZEMO MEME REVEALS MARVEL’S BIGGEST FLAW       Latest Editorial And News       The Kardashians Are Working Tirelessly To Scrub A Perfectly Normal Photo Of Khloé From The Web        Nathan Allebach Behind Steak-umm's Twitter Reveals How The Brand Immersed Itself In Internet Culture And Avoided Becoming ‘How Do You Do Fellow Kids?’        20 Bosses Of Peak Performance, Can You Defeat Them?        Serious Doubts Are Raised Over Infowars Video Claiming Alex Jones Is Stopping A Child Kidnapping"
2,Soviet Lord of the Rings / Khraniteli,https://i.kym-cdn.com/entries/icons/original/000/036/972/lotr1.jpg,"['Film', 'TV Show']",1991,2021-04-08T15:04:54-04:00,22,0,1,0,"Khraniteli, also known as Soviet Lord of the Rings, is a made-for-TV film adaptation of the first-part J.R.R. Tolkein Lord of the Rings series, The Fellowship of the Ring, produced for the Soviet Union television station Leningrad Television. Released in 1991, the film was unavailable for nearly 30 years, before being released on YouTube by Leningrad Television's successor 5-TV.","In 1991, Leningrad Television released a made-for-TV adaptation of The Fellowship of the Ring entitled Khraniteli (translation: ""The Keepers""). The film is a television play, shot on a stage live, without traditional coverage of wide shots, closeups and shot-reverse-shot commonly found in Hollywood films, including Peter Jackson's The Lord of the Rings. Khraniteli reportedly aired only once in the Soviet Union.[3]  Actor Valery Dyachenko, who plays Frodo in the film, told 5-TV:[1]","Top entries this week       Fluffy Ponies        Emergence (Metamorphosis)        Vinesauce        Creepy Chan (Allison Harvard)       History In 1991, Leningrad Television released a made-for-TV adaptation of The Fellowship of the Ring entitled Khraniteli (translation: ""The Keepers""). The film is a television play, shot on a stage live, without traditional coverage of wide shots, closeups and shot-reverse-shot commonly found in Hollywood films, including Peter Jackson's The Lord of the Rings. Khraniteli reportedly aired only once in the Soviet Union.[3]  Actor Valery Dyachenko, who plays Frodo in the film, told 5-TV:[1] Of course this is an event. Because in those years, in 1991, it was all just beginning. In general, Tolkien first appeared here in Russia in St. Petersburg. It is the Leningrad television, I am very grateful to him. It has always been a breakthrough. Now the genre of television performance has disappeared, which is a great pity. YouTube Release Khraniteli was long-thought lost after it aired and considered missing for nearly 30 years. On March 27th and 28th, 2021, the YouTube channel for 5-TV uploaded the film in two parts. The first part received more than 1.5 million views in less than two weeks, and the subsequent installment received more than 330,000 views (shown below, left and right).                        Reception The 2021 release film was generally positive reviews as a lost curio, with many noting the film's many bizarre choices, soft-focus photography and low-budget special effects. The Verge[2] said the film ""is a riot of low-budget special effects, bizarre camera work, and Soviet mood music"" that ""captures a completely legitimate aspect of The Lord of the Rings, just not one we’re necessarily used to."" Others, such as The Guardian[3] called the film ""schlocky"" but would ""scratch a nostalgic itch for many who watched it."" Online Reception The release of the film on YouTube inspired many conversations and memes on the internet. On April 6th, 2021, for example, Redditor shared a four-panel meme featuring some of the characters from the film in the /r/lotrmemes[4] subreddit. The post received more than 27,000 points (94% upvoted) and 330 comments in less than two days (shown below).    On April 7th, 2021, Twitter user @sovietvisuals tweeted, ""Excerpt from the 1991 Soviet television adaptation of The Lord of the Rings thought to have been lost but recently rediscovered."" The tweet received more than 1,500 likes and 400 retweets in less than 24 hours (shown below).  Excerpt from the 1991 Soviet television adaptation of The Lord of the Rings thought to have been lost but recently rediscovered. pic.twitter.com/5T1jVSSbyK — Soviet Visuals (@sovietvisuals) April 7, 2021                      Search Interest                        External References  [1] 5-TV – 'With Enthusiasm': Russian Frodo Dyachenko on filming 'The Guardians' [2] The Verge – The long-lost Lord of the Rings adaptation from Soviet Russia is a glorious fever dream [3] The Guardian – Soviet TV version of Lord of the Rings rediscovered after 30 years [4] Reddit – /r/lotrmemes                    Latest Editorial And News       Serious Doubts Are Raised Over Infowars Video Claiming Alex Jones Is Stopping A Child Kidnapping        Steven Crowder Under Fire After Recreating George Floyd's Killing By Getting Himself Kneeled On        20 Awful Facebook Memes To Fill Your Nightmares With Minions        25 Blessed Images To Get You Through The Week"
3,It'sAGundam,https://i.kym-cdn.com/entries/icons/original/000/036/971/itsagundamtitle.png,"['Comedian', 'Gamer', 'Vlogger']",2015,2021-04-08T14:49:26-04:00,126,8,5,0,"It'sAGundam is a comedian, vlogger, streamer,[2] and YouTube[1] ranter who is mostly known for making comedy type YouTube rant videos about the hypocrisy of Twitch Thots and E-girls. He currently has over 500K subscribers on YouTube.","During the GamerGate culture war, It'sAGundam joined YouTube on February 19th 2015 to make videos ranting about controversial people such as video game journalists and Anita Sarkeesian creating clickbait while antagonizing gamers.","Top entries this week       Fluffy Ponies        Emergence (Metamorphosis)        Vinesauce        Creepy Chan (Allison Harvard)       Origin During the GamerGate culture war, It'sAGundam joined YouTube on February 19th 2015 to make videos ranting about controversial people such as video game journalists and Anita Sarkeesian creating clickbait while antagonizing gamers. External Reference [1] YouTube – It'sAGundam [2] Twitch – itzagundam                    Search Interest         Latest Editorial And News       The Kardashians Are Working Tirelessly To Scrub A Perfectly Normal Photo Of Khloé From The Web        Nathan Allebach Behind Steak-umm's Twitter Reveals How The Brand Immersed Itself In Internet Culture And Avoided Becoming ‘How Do You Do Fellow Kids?’        20 Bosses Of Peak Performance, Can You Defeat Them?        Serious Doubts Are Raised Over Infowars Video Claiming Alex Jones Is Stopping A Child Kidnapping"
4,Alessandro Tomasi,https://i.kym-cdn.com/entries/icons/original/000/036/970/tomasi.jpg,"['Artist', 'Creator']",2020,2021-04-08T14:16:26-04:00,198,0,31,0,"Alessandro Tomasi is an Italian online artist specialized in facial reconstructions of ancient historical figures based on their busts, statues and physical descriptions of their time. Tomasi gained popularity thanks to the realistic appearance and detailed features of his reconstructions, which aspire in portraying the look of various historical figures as accurately as possible.",,"Top entries this week       Fluffy Ponies        Emergence (Metamorphosis)        Vinesauce        Creepy Chan (Allison Harvard)       Online History Tomasi's very first works can be traced back to the 4chan board /his/. On August 30th, 2020, he started a thread sharing his reconstruction of Pericles, with the original bust next to it[1] (shown below). He stated in the opening post ""To the anon who asked for a reconstruction of a Pericles bust in the thread that got deleted, here you go"".    Impressed by his work, anonymous /his/ users asked him to make more reconstructions, of various other historical figures. As Tomasi posted more reconstructions, he answered a few questions about himself, and when other users asked him about Canadian cinematographer Daniel Voshart[2], Tomasi expressed his disdain for him and his ROMAN EMPEROR PROJECT[3], calling him a ""canadian cuck"" and ""an afro-centrist idiot"" who, unlike himself, was good at self-advertising. Tomasi then linked his Twitter account[4], stating that he was just getting started on the site.     In the thread, as an anonymous user questioned Voshart's Afrocentrism, another user posted evidence of him considering various Roman emperors ""Black"", and using that to push his political agenda (shown below).    On January 26th, 2021, American-Lebanese essayist Nassim Nicholas Taleb retweeted Tomasi's reconstruction of Posidonius[5] (shown below, left). On January 28th, 2021, Medium user Peter Preskar featured in his article ""Elagabalus: The Transgender Roman Emperor""[6] Tomasi's Elagabalus reconstruction from /his/ (shown below, right).     On February 10th, 2021, The Vale Magazine published an article[7] about Tomasi and his work, featuring his reconstruction of ancient Greek author Homer (shown below, left). On February 24th, 2021, Tomasi posted his reconstruction of Roman emperor Vitellius[8] (shown below, left), which would become his most popular work.     The Vitellius reconstruction was retweeted by Taleb[9] and by British author Tom Holland[10]. In the comments, Twitter user @Ozgur_Ozubek edited Vitellius' skin tone, making it lighter[11], only to be parodied upon by @NamaJeff19 who made his skin completely white[12] (shown below, left). Twitter user @suckmydick_jack retweeted Tomasi's Vitellius stating ""This is just a guy from New Jersey""[13], receiving over 28,000 retweets and over 250,000 likes in 3 months (shown below, right).     On March 7th, 2021, a Virgin Vs Chad meme[14] featuring both Voshart and Tomasi, was posted on /his/ (shown below).    On March 19th, 2021 an anonymous /his/ user shared an edit[15] of Tomasi's profile picture that referenced Pepe The Frog (shown below, left), which was then replied with a ""Yes."" with the original profile picture (shown below, right) in reference to the Yes Chad.                        Personal Life In an interview with Bored Panda[16], Tomasi stated to be 20 years old, a student from Florence, and being of Italian and Lebanese descent. On /his/, Tomasi stated that he frequents a classical arts academy, and does these reconstructions for fun during his free time. In the interview with Bored Panda, he explained that he has always been interested in history, Greco-Roman and Phoenician history, in particular, and that he launched this little facial reconstruction project after seeing others do it online. He also stated  “I decided to start doing these reconstructions after coming across other reconstructions on the internet, which have obviously been done by people with absolutely no knowledge about genetics or history. Other than the fact that it is very interesting for me to bring busts to life, the main reason I started making them is basically a response to the other historically inaccurate ones I saw.""  He also stated  “I would say the biggest challenge is trying to find the right bust to work from. I always try to find busts made during the lifetime of the person I am reconstructing the face of when I can, to be as accurate as possible.”  Bored Panda's article revealed that Hannibal Barca seemed to be his favorites work at that point, and also enjoyed how his reconstruction of Cicero turned out.                     Search Interest                        External References  [1] /his/ – Thread # 9357514 [2] Daniel Voshart – Daniel Voshart [3] Daniel Voshart – ROMAN EMPEROR PROJECT [4] Twitter – Alessandro Tomasi [5] Twitter – Nicholas Nassim Taleb [6] Medium – Elagabalus: The Transgender Roman Emperor [7] The Vale Magazine – Alessandro Tomasi Revitalizes History With New Tech [8] Twitter – Face reconstruction of the Roman emperor Vitellius [9] Twitter – What gives me the impression that one of the descendants owns a few gas stations in New Jersey? [10] Twitter – Like one of those listless animals which lie sluggish and torpid so long as you supply them with food. Tacitus on Vitellius. [11] Twitter – Do you specificially pick that skin tone? Not pale, not sun tanned? It is kinda too reddish for my taste. Just asking your opinion.  added an alternative here [12] Twitter – Yo dude, you didn't make him white enough yet, here I fixed it for you [13] Twitter – This is just a guy from New Jersey [14] /his/ – Thread # 10602957 [15] /his/ – Thread # 10691392 [16] Bored Panda – Guy Uses Modern Software To Restore The Faces Of Julius Caesar And 23 Other People From Ancient History                    Latest Editorial And News       The Kardashians Are Working Tirelessly To Scrub A Perfectly Normal Photo Of Khloé From The Web        Nathan Allebach Behind Steak-umm's Twitter Reveals How The Brand Immersed Itself In Internet Culture And Avoided Becoming ‘How Do You Do Fellow Kids?’        20 Bosses Of Peak Performance, Can You Defeat Them?        Serious Doubts Are Raised Over Infowars Video Claiming Alex Jones Is Stopping A Child Kidnapping"
5,Cat Being Dragged From Window,https://i.kym-cdn.com/entries/icons/original/000/036/969/cat.jpg,['Image Macro'],2018,2021-04-08T13:26:00-04:00,482,0,12,1,Cat Being Dragged from Window is a four-panel image macro meme featuring a person in a white shirt attempting to pull a cat from the space between a wall and a window.,"The origin of the photograph is unknown. On December 19th, 2018, Twitter [1] user @yasmeentxt tweeted the four photos of a cat being removed from the area between a wall and a window. They captioned the photos, ""me pushing myself to leave my comfort zone."" The tweet received more than 116,000 likes and 50,000 retweets in less than three years (shown below).","Top entries this week       Fluffy Ponies        Emergence (Metamorphosis)        Vinesauce        Creepy Chan (Allison Harvard)       Origin The origin of the photograph is unknown. On December 19th, 2018, Twitter [1] user @yasmeentxt tweeted the four photos of a cat being removed from the area between a wall and a window. They captioned the photos, ""me pushing myself to leave my comfort zone."" The tweet received more than 116,000 likes and 50,000 retweets in less than three years (shown below).                       Spread The following day, on December 19th, 2018, Redditor buttandbrains shared an object labeling variation of the meme in the /r/funny.[2] The post received more than 1,700 points (97% upvoted) in less than three years. One day later, buttandbrains shared the meme in the /r/meow_irl,[3] where it received more than 24,000 points (97% upvoted) and 125 comments in less than three years (shown below, left). Months later, on February 17th, 2019, Twitter[4] user @itsashlyperez tweeted the images with the caption, ""May I present to you my favorite series of photos ever. Caption as you will."" The tweet received more than 24,000 likes and 5,000 retweets in less than three years (shown below, center). On March 21st, 2021, Twitter[5] user @zei_squirrel shared a variation about German philosopher  Karl Marx. The post received more than 30,000 likes and 5,200 retweets in less than one month (shown below, right).                         Various Examples          Template    Search Interest Not available.                    External References  [1] Twitter – @yasmeentxt's Tweet [2] Reddit – /r/funny [3] Reddit – /r/MEOW_IRL [4] Twitter – @itsashlyperez's Tweet [5] Twitter – @zei_squirrel's Twete      Latest Editorial And News       The Kardashians Are Working Tirelessly To Scrub A Perfectly Normal Photo Of Khloé From The Web        Nathan Allebach Behind Steak-umm's Twitter Reveals How The Brand Immersed Itself In Internet Culture And Avoided Becoming ‘How Do You Do Fellow Kids?’        20 Bosses Of Peak Performance, Can You Defeat Them?        Serious Doubts Are Raised Over Infowars Video Claiming Alex Jones Is Stopping A Child Kidnapping"
